text,category
 статья м а калашниковой г а куриной большое спасибо уважаемая вероника викторовна сообщение с наилучшими пожеланиями курина уважаемые авторы редакцией журнала вестник вгу серия системный анализ информационные технологии получена статья калашникова м а курина г а приближения любого порядка асимптотического решения трехтемповой линейноквадратичной задачи оптимального управления методом прямой схемы статья принята номер макет верстки статьи выслан сверки сегодня файл сегодня файл сегодня файл глубокоуважаемая редакция очень просим вас прислать корректуру статьи с наилучшими пожеланиями авторы глубокоуважаемая редакция высылаю статью возможной публикации вашем журнале в смысле оформления согласно правилам журнала сделали все смогли с наилучшими пожеланиями авторы глубокоуважаемая редакция высылаю статью возможной публикации вашем журнале в смысле оформления согласно правилам журнала сделали все смогли с наилучшими пожеланиями авторы глубокоуважаемая редакция высылаю статью возможной публикации вашем журнале в смысле оформления согласно правилам журнала сделали все смогли с наилучшими пожеланиями авторы галина курина галина курина,рецензирование
новая статья в г задорожнего г а куриной вгу задорожний курина docx глубокоуважаемая редакция высылаем статью возможной публикации журнале просим прислать корректуру с наилучшими пожеланиями авторы,подача статьи
 новая статья в г задорожнего г а куриной image png уважаемая редакция являюсь автором одной статей я большой эксперт использования word поэтому переспрошу статьи набирались word редактор формул панели в правилах сказано набрать ms word выше это требование является выполненным у другого редактора формул word поясните пожалуйста какименно нужно набирать формулы версии word может шаблон нужного word документа может можете прислать инструкцию именно выбрать нужный формат формул есть способ както переконвертировать формулы поможет сохранение word жду ответа поскольку совершенно понимаю исправить связи имеющимся приложением office маргарита калашникова уважаемые авторы статья получена редакцией есть замечание оформлению двум присланным статьям приближения любого порядка асимптотического решения трехтемповой линейноквадратичной задачи оптимального управления методом прямой схемы м а калашникова г а курина управление системой обеспечивающее периодическое в среднем решение в г задорожний г а курина все формулы обозначения символов тексте должны набраны equation mathtype нужно перенабрать формулы ждем конца недели глубокоуважаемая редакция высылаем статью возможной публикации журнале просим прислать корректуру с наилучшими пожеланиями авторы галина курина margarita kalashnikova,доработка
о николае docx о николае docx здравствуйте вероника викторовна высылаю вам предварительный вариант заметки николае аркадиевиче я разослал нескольким коллегам предмет оценивания корректировки числе дополнения надеюсь получить отклик с уважением в хлебостроев,подача статьи
статья публикации томск григорьева т е дегтярева н а дмитриев в м docx рисунок jpg рисунок jpg рисунок jpg сведения авторах docx здравствуйте уважаемая редакция журнала направляем вам статью концептуальная модель планирования процесса снегоуборки авторов григорьевой т е дегтяревой н а дмитриева в м опубликования вашем журнале серии системный анализ информационные технологии к статье прикладываем сведения авторах рисунки статье заранее большое спасибо танюшка григорьева,подача статьи
 новая статья в г задорожнего г а куриной image png zad kurina paper vsu doc вгу калашникова курина doc уважаемая редакция дополнительно отправляю статьи сохраненные старой версии word посмотрите пожалуйста удовлетворят требованиям пожалуйста ответье возможность в случае дополнительной корректировки формул потребует очень времени маргарита калашникова уважаемая редакция являюсь автором одной статей я большой эксперт использования word поэтому переспрошу статьи набирались word редактор формул панели в правилах сказано набрать ms word выше это требование является выполненным у другого редактора формул word поясните пожалуйста какименно нужно набирать формулы версии word может шаблон нужного word документа может можете прислать инструкцию именно выбрать нужный формат формул есть способ както переконвертировать формулы поможет сохранение word жду ответа поскольку совершенно понимаю исправить связи имеющимся приложением office маргарита калашникова уважаемые авторы статья получена редакцией есть замечание оформлению двум присланным статьям приближения любого порядка асимптотического решения трехтемповой линейноквадратичной задачи оптимального управления методом прямой схемы м а калашникова г а курина управление системой обеспечивающее периодическое в среднем решение в г задорожний г а курина все формулы обозначения символов тексте должны набраны equation mathtype нужно перенабрать формулы ждем конца недели глубокоуважаемая редакция высылаем статью возможной публикации журнале просим прислать корректуру с наилучшими пожеланиями авторы галина курина margarita kalashnikova margarita kalashnikova,подача статьи
 новая статья в г задорожнего г а куриной image png вгу калашникова page test docx уважаемая редакция уважаемая вероника викторовна я сделала одну страницу новом редакторе формул mathtype пожалуйста посмотрите удовлетворяет требованиям журнала маргарита калашникова уважаемая редакция дополнительно отправляю статьи сохраненные старой версии word посмотрите пожалуйста удовлетворят требованиям пожалуйста ответье возможность в случае дополнительной корректировки формул потребует очень времени маргарита калашникова уважаемая редакция являюсь автором одной статей я большой эксперт использования word поэтому переспрошу статьи набирались word редактор формул панели в правилах сказано набрать ms word выше это требование является выполненным у другого редактора формул word поясните пожалуйста какименно нужно набирать формулы версии word может шаблон нужного word документа может можете прислать инструкцию именно выбрать нужный формат формул есть способ както переконвертировать формулы поможет сохранение word жду ответа поскольку совершенно понимаю исправить связи имеющимся приложением office маргарита калашникова уважаемые авторы статья получена редакцией есть замечание оформлению двум присланным статьям приближения любого порядка асимптотического решения трехтемповой линейноквадратичной задачи оптимального управления методом прямой схемы м а калашникова г а курина управление системой обеспечивающее периодическое в среднем решение в г задорожний г а курина все формулы обозначения символов тексте должны набраны equation mathtype нужно перенабрать формулы ждем конца недели глубокоуважаемая редакция высылаем статью возможной публикации журнале просим прислать корректуру с наилучшими пожеланиями авторы галина курина margarita kalashnikova margarita kalashnikova margarita kalashnikova,доработка
статья вестник вгу серия системный анализ информационные технологии повторная отправка рецензирования sharov k d medvedeva o a model otsenki kditosposobnosti zaemschikov na osnove nechetkoy logiki docx sharov k d medvedeva o a model otsenki kditosposobnosti zaemschikov na osnove nechetkoy logiki pdf повторно оправляю статью устранения приведенных замечаний уважаемые авторы получена рецензия статью модель оценки кредитоспособности заемщиков на основе нечеткой логики шаров к д медведева о а рецензия содержит замечания устранения которых статья опубликована текст рецензии прикрепляю отв секретарь журнала гаршина вероника викторовна,доработка
proнэикон августоктябрь открыть письмо браузере выпуск № августоктябрь новости нэикон опубликован первый выпуск журнала наука научная информация scholarly search and information журнал публикует научные материалы всем вопросам связанным созданием продвижением использованием электронных научных образовательных ресурсов определением места роли электронных информационных ресурсов сервисов процессе научного исследования решении вопросов государственной политики направленной повышение уровня образования науки качества научных публикаций развития системы научных периодических изданий расширения присутствия международном научноинформационном пространстве журнал наука научная информация выходит квартал открытой лицензией cative commons attribution license статьи журнале публикуются модели золотого платинового открытого доступа плата публикацию статей взимается принимаются рассмотрению статьи русском английском языках журнал наука научная информация зарегистрирован сми имеет issn префикс doi проект нора национальный агрегатор открытых репозиториев российских университетов проблемы разработки институциональных репозиториев проанализированы конференции «университетская библиотека точки роста» сентября томск докладе «переосмысление роли институционального репозитория» евгения николаевича струкова директора научной библиотеки им н и лобачевского казанского федерального университета – участника проекта нора доклад основных принципах положениях текущем состоянии проекта нора представлен конференции libway сентября новосибирск скалабан алексей витальевич «нора – национальный агрегатор открытых репозиториев российских университетов» ноября г в тюмени проводиться серия семинаров посвященных вопросам открытого доступа научной информации ранее семинары рамках проекта нора проводились томске казани санктпетербурге красноярске твери видеозаписи презентации докладов доступны разделе “мероприятия” сайте проекта чтобы принять участие проекте нора заполните заявку напишите марине зельдиной адресу elpub журналы платформе elpub получили новый дизайн который создавался командой российских международных экспертов если хотите получить подробную информацию работе платформой elpub свяжитесь максимом митрофановым на платформе elpub размещено журналов “бюллетень сибирской медицины” ”хирургия позвоночника” “юг россии экология развитие” “информационноуправляющие системы” вошли scopus “цифровая экономика” “управленческие науки” “финансы теория практика” “мир новой экономики” безопасность риск фармакотерапии включены doaj “мир модернизация инновации развитие включен econlit crossf нэикон открыл русскоязычную линию поддержки организаций работающих crossf мы будем рады поделиться вами опытом накопленным лет работы crossf с нашей помощью организации стали членами pila в рамках рамках работы русскоязычными пользователями мы поможем правильно сформировать запрос техподдержку crossf разберемся почему получается зарегистрировать doi ответим любые вопросы которые возникли работе crossf чтобы получить консультацию отправьте запрос конференции семинары программы повышения квалификации опубликованы презентации докладов й международной конференции нэикон «электронные научные образовательные ресурсы создание продвижение использование» сентября ереван армения опубликованы презентации видеозаписи докладов серии семинаров проекту “национальный агрегатор открытых репозиториев российских университетов” сентября красноярск издательские услуги нэикон нэикон оказывает научным журналам весь комплекс услуг предпечатной подготовке печати научных журналов мы делаем верстку pdf html техническое редактирование корректуру литературное редактирование отрисовку переводы печать рассылку отправку выпусков ринц регистрацию doi и многое другое в портфеле издательства нэикон настоящий момент журналов чтобы получить подробную информацию издательских услугах нэикон свяжитесь максимом митрофановым услуги библиотек научных организаций в ответ потребность научных организаций предоставлении доступа результатам научных исследований нэикон разработал сервис “репозиторий научной организации” репозиторий агрегирует данные научных исследованиях организации является единой точкой доступа ним позволяет управлять авторскими правами передавать метаданные российские международные поисковые системы повышает видимость цитируемость работ в числе архивных чтобы узнать сервисе “репозиторий научной организации” свяжитесь максимом митрофановым copyright © нэикон все права защищены данное письмо требует ответа по всем возникающим вопросам обращайтесь контактному лицу указанному выше чтобы изменить настройки подписки воспользуйтесь одной ссылок изменить настройки подписки отписаться рассылки ,другое
 сверка статьи привет вероника вроде правильно вс окт г vestnik vsu алексей привет надо проверить верстку статьи ошибки прикрепляю гаршина вероника,проверка статьи
 статья рецензирование демченко м исследование сравнительный анализ методов оптимизации нейронных сетей вестник вгу doc здравствуйте вероника викторовна направляю рассмотрение статью вестник вгу саит уважаемая ирина леонидовна прошу отрецензировать статью научного журнала вестник вгу саит и а седых в а истомин нейросетевое моделирование процесса охлаждения полосы на стане горячей прокатки большая просьба сделать это оперативно т к многие статьи оформлены правильно авторам нужно корректировать оформление шаблон рецензии файл правилами оформления статей прикрепляю каширина ирина каширина ирина,подача статьи
