text,category
статья вологды первый номер журнала рапаков горбунов сравнительная оценка эффективности doc рецензия рапаков горбунов doc здравствуй вероника по просьбе наших друзей вологды повторно направляю статью они просили опубликовать её первом номере журнала её приняли заседании редколлегии я просмотрел статью целом производит хорошее впечатление соответствует тематике журнала рецензию составил рекомендую статью опубликованию кургалин,готово к публикации
 статья вологды здравствуй вероника они могут пока сказать напутал подали итоге ту статью т е получилось статья подана второй раз та статья которая нужна оказалась отправленной я вчера сказал в а горбунову таком виде эта новая статья подойдет журнала журнал теоретический именно тех областях которые обозначены названии системный анализ информационные технологии тех пунктах которые указаны сайте как предварительно говорили статье желателен системный анализ статья должна теоретической достаточно большим числом формул проведением именно теоретического анализа выводами него пока статье практические результаты довольно узкой специальной прикладной области сильно перевешивают небольшую теорию должно быть статья сделана журнал экологии журнала стистемному анализу как понимаю практические результаты небольшом количестве должны конце статьи иллюстрировать подтверждать теоретические выводы должны самой большой основной частью статьи кургалин v сергей дмитриевич v да это та статья которую вы пересылали v сверстали макет v верстки прикрепляю после сверки авторы v ответили опубликована v нашем журнале v v это действительно так v странно подали раз я v сегодняшнего рецензирования v могла предположить опубликована v поэтому мысли проверке v возникло прошло лет статья забылась v в следующем письме перешлю ответ авторов v вновь присланный материал статьи v новой рецензирования v надо уточнить точно эта нигде опубликована v v здравствуй вероника по просьбе наших друзей вологды повторно направляю статью они просили опубликовать её первом номере журнала её приняли заседании редколлегии я просмотрел статью целом производит хорошее впечатление соответствует тематике журнала рецензию составил рекомендую статью опубликованию кургалин,доработка
статья рассмотрение галинов п и повышение производительности технологического процесса создания песчанополимерных литейных форм методом послойного синтеза помощью оптимизации движения печатающей головки docx уважаемая редакция прошу вас рассмотреть возможность публикации моей статьи вашем журнале скажите пожалуйста стоимость публикации мне очень важна публикация августа года какой вас ближайший выпуск у статьи которые готов вам отправить прошу вас войти мое положение рассмотреть мою статью скорее статья вложении петр галинов,подача статьи
артюшенко воловач статья артюшенко воловач статья zip уважаемые коллеги направляем статью в и воловача в м артюшенко обнаружение сигналов случайным моментом появления использованием алгоритма кумулятивных сумм публикации журнале вестник вгу серия системный анализ информационные технологии заранее благодарен владимир иванович воловач д т н доцент зав кафедрой информационного электронного сервиса поволжского государственного университета сервиса,подача статьи
 статья рецензирование к какому сроку надо вс мар г vestnik vsu алексей привет посылаю статью рецензию вестника также прикрепляю шаблон рецензии правила оформлению статей вероника гаршина,вопросы
 статья рецензирование можешь сама отправить радченко юрий степанович vestnik vsu пишет александр анатольевич получена статья в и воловач в м артюшенко обнаружения сигналов со случайным моментом появления с использованием алгоритма кумулятивных сумм эти авторы публиковались нашем журнале рецензентом тематике профессор кафедры радиофизики вгу радченко ю с у контактов могли вы переслать просьбу отрецензировать данную статью прикрепляю статью шаблон рецензии ,рецензирование
 вестник саит здравствуйте вероника викторовна с большой радостью получил адрес сборника мне очень понравился сборник содержательностью оформлением некоторые статьи просто блистательны большое спасибо заботу которой вы окружаете своих авторов я публикуюсь многих журналах однако такого внимания ранее ощущал рад вами общаться всего вам доброго будьте счастливы с ув одинцов б е уважаемые авторы прикрепляю готовый макет журнала вестник вгу серия саит чуть позже размещен сайте журнала напечатан издательским домом вгу ,другое
 рецензия статью здравствуйте вероника викторовна материалы статье получил рецензию напишу sergei вс мар г vestnik vsu сергей прошу отрецензировать статью вестника прикрепляю статью шаблон рецензии действующие правила оформлению статей вероника гаршина,рецензирование
консультация включению изданий wos scopus другие библиографические базы регистрация doi открыть письмо отдельном окне браузера консультация включению wos scopus другие библиографические базы уважаемый издатель если ваша орагнизация планирует подачу заявки включение журнала wos scopus вак doaj chemical abstracts cas geof pubmed erihplus agris другие наукометрические базы данных рацс предоставляет услугу консалтингу соответствие издания требованиям библиографических баз данных рацс проведет полный аудит издания подготовит необходимые конкретные рекомендации улучшению издания сайта издания информации нем для заказа услуги пожалуйста заполните форму сайте контактная информация или позвоните нам данное письмо отправлено ваша организация является клиентом рацс если вы желаете получать рассылок пожалуйста отпишитесь нажав ссылку ниже отписаться © русское агенство цифровой стандартизации,другое
 вестник саит здравствуйте вероника викторовна спасибо большое присланный макет журнала надеемся дальнейшее сотрудничество вами приятно работать уважаемые авторы прикрепляю готовый макет журнала вестник вгу серия саит чуть позже размещен сайте журнала напечатан издательским домом вгу ,другое
 вакcкая статья е н десятирикова ходар алмосана rar pictus rar здравствуйте вероника викторовна я отправил статью двух видах первый вид стандартном шрифте второй вид колонках и хотел узнать вы завтра будете факультете сколько перенести статью флешке vestnik vsu вакcкая статья е н десятирикова уважаемые авторы представленный файл содержит ошибки открытии при восстановлении файла пострадали формулы сделайте стандартные шрифты пришлите файл повторно новый подход к планированию ресурсов виртуальных машин в облачных вычислениях на основе генетического алгоритма э к алгазинов е н десятирикова ияд алхаят ходар алмосана алькади усама воронежский государственный университет университет дамаска сирия,доработка
о статьях марта вестник саит апреля здравствуйте уважаемая вероника викторовна направляем вам двумя отдельными письмами материалы вёрстки наших статей марта формате word до конца апреля решили тянуть в каждом писем содержатся архивов zip в первых архивах материалы вёрстки word е bilchenko ggjr ng sait rtf maket col zip макет колонки см формате rtf формулы msequation bilchenko ggjr ng sait rtf plain col zip статья колонка см формате rtf формулы msequation bilchenko ggjr ng sait figus png zip рисунки формате png bilchenko ggjr ng sait figus tiff zip рисунки формате tiff в архиве bilchenko ggjr ng sait documents zip содержатся файла в формате rtf сопроводительной информацией bilchenko ggjr ng sait вариант колонтитула варианты форматирования заголовка rtf содержит варианта колонтитулов название статьи заглавными строчными буквами bilchenko ggjr ng sait подписи к рисункам rtf содержит описание вставленных rtf рисунков png подписи формате word формулами msequation bilchenko ggjr ng sait сведения об авторах rtf содержит сведения авторах на русском английском bilchenko ggjr ng sait удк ключевые слова аннотация rtf содержит ключевые слова аннотации названия на русском английском на всякий случай также прикреплены архива материалами вёрстки tex е bilchenko ggjr ng sait tex with eps zip содержит полный набор файлов включая каталог рисунками формате eps компиляции двух вариантов одноколоночный двухколоночный вёрстки tex е bilchenko ggjr ng sait pdf plain col zip содержит одноколоночный результат компиляции в формате pdf напишите пожалуйста достаточно чтото ещё необходимо прислать заранее благодарны наталья григорий мл бильченко,подача статьи
 вакcкая статья е н десятирикова docx здравствуйте вероника викторовна вчера еленой николаевной исправили текст статьи меня попросили срочно отправить вам from vestnik vsu sent tuesday april to subject вакcкая статья е н десятирикова добрый день завтра буду кафедре тоизи а подходите гаршина в в здравствуйте вероника викторовна я отправил статью двух видах первый вид стандартном шрифте второй вид колонках и хотел узнать вы завтра будете факультете сколько перенести статью флешке vestnik vsu вакcкая статья е н десятирикова уважаемые авторы представленный файл содержит ошибки открытии при восстановлении файла пострадали формулы сделайте стандартные шрифты пришлите файл повторно новый подход к планированию ресурсов виртуальных машин в облачных вычислениях на основе генетического алгоритма э к алгазинов е н десятирикова ияд алхаят ходар алмосана алькади усама воронежский государственный университет университет дамаска сирия,доработка
 о статьях марта вестник саит апреля здравствуйте уважаемая вероника викторовна спасибо оперативный ответ с наилучшими пожеланиями наталья григорий мл бильченко vestnik написал а наталья добрый день материалы статьям получила по комплекту документов оформлению замечаний нет комплектование верстка номера планируем мая тогда свяжемся ,другое
 опись предоставленных файлов docx рисунок схема душирования jpg рисунок обобщённая структура нейронной сети рбф jpg ещё файлов здравствуйте вероника викторовна можно узнать продвижении статьи седых и а истомин в а нейросетевое моделирование процесса охлаждения полосы стане горячей прокатки уважаемые авторы статья находится повторном рецензировании результаты сообщим гаршина в в уважаемая гаршина вероника викторовна отправляем исправленную дополненную статью соответствии замечаниями рецензента владимир истомин владимир истомин нейросетевое моделирование процесса охлаждения полосы на стане горячей прокатки,вопросы
 статья рецензирование рецензия вахтин а а docx вс мар г vestnik vsu время недели к какому сроку надо вс мар г vestnik vsu алексей привет посылаю статью рецензию вестника также прикрепляю шаблон рецензии правила оформлению статей вероника гаршина,рецензирование
 статья рецензия хальзов doc хальзов фертиков аппроксимация диаграммы вороного kго порядка docx очень понравилось замечания рекомендации рецензии я внес небольшие правки текст далее работаете ним на будущее работаете документом полученным меня имею привычку вносить небольшие правки чужие тексты сам особенно аспирантов сергей хальзов пишет высылаю статью диаграммам вороного рисунки литература сергей хальзов,рецензирование
 сверка статьи sergeevobzorblock doc сергеев актэксп воронеж pdf уважаемая редакция журнала вестник вгу уважаемая вероника викторовна знакомый коллектив авторов ростованадону дгту направляет ваш журнал одну статью посвященную применению параллельного комбинированного биоинспирированного метода реализации криптоанализа симметричных систем шифрования ранее наш коллектив авторов публиковал статьи подобного плана обзор авторских работ посвященных применению биоинспирированных методов реализации криптоанализа классических асимметричных методов шифрования также блочных систем шифрования номере год стр номере год стр вероника викторовна буду вам признателен вы примете рассмотрению материалы нашей статьи статья набрана соответствии правилами шрифтом ссылка грант сведения авторах русском английском языках помещены конце статьи прилагаются акт экспертизы файл текстом статьи вероника викторовна заранее будем признательны статья опубликована ближайшее время подтвердите получение статьи этому электронному адресу c уважением контактный автор сергеев а с тел эл адрес ,подача статьи
 рецензия статью рецгалинов docx здравствуйте вероника викторовна высылаю рецензию работу п и галинова статья показалась очень слабой но некоторой доработки см рецензию опубликовать быть возможно конечно настаиваю именно таких изменениях статье как видится журнала слабо подходит тема интересная перспективе опубликовать можно sergei пн апр г sergei borzunov здравствуйте вероника викторовна материалы статье получил рецензию напишу sergei вс мар г vestnik vsu сергей прошу отрецензировать статью вестника прикрепляю статью шаблон рецензии действующие правила оформлению статей вероника гаршина,рецензирование
статья публикации журнале вестник вгу sergeevobzorblock doc сергеев актэксп воронеж pdf уважаемая редакция журнала вестник вгу уважаемая вероника викторовна знакомый коллектив авторов ростованадону дгту направляет ваш журнал одну статью посвященную применению параллельного комбинированного биоинспирированного метода реализации криптоанализа симметричных систем шифрования ранее наш коллектив авторов публиковал статьи подобного плана обзор авторских работ посвященных применению биоинспирированных методов реализации криптоанализа классических асимметричных методов шифрования также блочных систем шифрования номере год стр номере год стр вероника викторовна буду вам признателен вы примете рассмотрению материалы нашей статьи статья набрана соответствии правилами шрифтом ссылка грант сведения авторах русском английском языках помещены конце статьи прилагаются акт экспертизы файл текстом статьи вероника викторовна заранее будем признательны статья опубликована ближайшее время просьба обязательно подтвердить получение статьи этому электронному адресу c уважением сергеев а с тел эл адрес ,подача статьи
