text,category
 публикация статьи отлично спасибо большое витенбург екатерина александровна моб уважаемые авторы редакцией журнала вестник вгу саит получены материалы статьи математическая модель интеллектуальной поддержки принятия решений при проектировании системы защиты информационной системы предприятия с учетом мониторинга событий безопасности статья передана рецензирование недели рецензируем статьи номер выход январь добрый день статья принята другим журналом печати связи этим направляю ваш адрес другую статью оформленную требованиям журнала уточните срок рецензирования в случае принятия статьи публикации опубликована витенбург екатерина александровна моб уважаемые авторы редакцией журнала вестник вгу серия саит получена статья формализованная модель оценки защищенности информационной системы предприятия левцова а а витенбург е а статья оформлена действующим правилам журнала см раздел авторам после соответствующей доработки передана рецензирование добрый день подскажите возможна публикация данной статьи вашем журнале какие сроки рецензирования публикации материалов витенбург екатерина александровна моб email ,готово к публикации
 публикация статьи добрый день прошу уточнить результаты рецензирования статьи информация письме ниже витенбург екатерина александровна уважаемые авторы редакцией журнала вестник вгу саит получены материалы статьи математическая модель интеллектуальной поддержки принятия решений при проектировании системы защиты информационной системы предприятия с учетом мониторинга событий безопасности статья передана рецензирование недели рецензируем статьи номер выход январь добрый день статья принята другим журналом печати связи этим направляю ваш адрес другую статью оформленную требованиям журнала уточните срок рецензирования в случае принятия статьи публикации опубликована витенбург екатерина александровна моб уважаемые авторы редакцией журнала вестник вгу серия саит получена статья формализованная модель оценки защищенности информационной системы предприятия левцова а а витенбург е а статья оформлена действующим правилам журнала см раздел авторам после соответствующей доработки передана рецензирование добрый день подскажите возможна публикация данной статьи вашем журнале какие сроки рецензирования публикации материалов витенбург екатерина александровна моб email ,вопросы
 публикация статьи добрый день хотела уточнить результаты рецензирования статьи витенбург екатерина александровна главный инженерпроектировщик cистем информационной безопасности группы проектирования систем информационной безопасности отдел аналитики проеткирования систем информационной безопасности департамент системной интеграции ооо иц региональные системы г волгоград ул социалистическая тел тел доб моб уважаемые авторы редакцией журнала вестник вгу саит получены материалы статьи математическая модель интеллектуальной поддержки принятия решений при проектировании системы защиты информационной системы предприятия с учетом мониторинга событий безопасности статья передана рецензирование недели рецензируем статьи номер выход январь добрый день статья принята другим журналом печати связи этим направляю ваш адрес другую статью оформленную требованиям журнала уточните срок рецензирования в случае принятия статьи публикации опубликована витенбург екатерина александровна моб уважаемые авторы редакцией журнала вестник вгу серия саит получена статья формализованная модель оценки защищенности информационной системы предприятия левцова а а витенбург е а статья оформлена действующим правилам журнала см раздел авторам после соответствующей доработки передана рецензирование добрый день подскажите возможна публикация данной статьи вашем журнале какие сроки рецензирования публикации материалов витенбург екатерина александровна моб email ,вопросы
статья азарновой полухин п в статья вестник вгу docx вероника добрый день высылаю статью моего ученика докторант вестника татьяна михайловна леденева сказала даст нам рецензию с уважением азарнова т в ,подача статьи
от махортова махортовлещинская docx здравствуйте вероника викторовна статья – вложении… сд,подача статьи
приглашаем проект «открытая наука россии» открыть письмо браузере уважаемые коллеги приглашаем проект «открытая наука россии» поддержанный фондом президентских грантов году «открытая наука россии» является продолжением развитием проекта«национальный агрегатор открытых репозиториев» нора сегодня нора объединяет российских организаций оба проекта выполняет консорциум нэикон партнерстве ведущими российскими университетами научноисследовательскими организациями в – гг будут решены следующие практические задачи модернизация репозиториев платформы нора соответствии новыми международными требованиями наполнение российских репозиториев интеграция ресурсов мировые открытые системы развитие новых сервисов технического сопровождения наполнения репозиториев развитие новых сервисов авторов популяризация проекта повышение информационной правовой грамотности целевых групп проекта преимущества вашего участия проекте подтвержденные опытом партнеров нора рост числа расширения географии обращений ресурсам вашего репозитория счет повышения видимости мировом информационном пространстве рост показателей использования цитирования публикаций ученых вашей организации счет размещения мировом пространстве публикаций зеленого открытого доступа экспорт метаданных ресурсов вашего репозитория международные каталоги базы данных worldcat openai base все настройки экспорту выполнит нэикон резервирование хранение ресурсов вашего репозитория платформе нора повышение информационной правовой грамотности сотрудников вашей организации счет участия мероприятиях проекта организация мероприятий проекта вашей площадке непрерывного образования участников целевых групп проекта вашем регионе участие проекте бесплатное в – гг нэикон разработает вас рекомендации созданию метаданных соответствии современными международными стандартами требованиями plan s технологии экспорта записей web of science scopus репозитории организаций – участников нора мероприятия проекта «открытая наука россии» пройдут владивостоке калининграде москве новосибирске санктпетербурге судаке условия подключения платформе нора описаны странице «как подключиться» материалы прошедших семинаров опубликованы разделе «мероприятия» опубликованные методические материалы найти ссылке если вопросы участии проекте задать ответ это письмо услуги библиотек научных организаций в ответ потребность научных организаций предоставлении доступа результатам научных исследований нэикон разработал сервис “репозиторий научной организации” репозиторий агрегирует данные научных исследованиях организации является единой точкой доступа ним позволяет управлять авторскими правами передавать метаданные российские международные поисковые системы повышает видимость цитируемость работ в числе архивных чтобы узнать сервисе “репозиторий научной организации” свяжитесь максимом митрофановым copyright © нэикон все права защищены данное письмо требует ответа по всем возникающим вопросам обращайтесь контактному лицу указанному выше чтобы изменить настройки подписки воспользуйтесь одной ссылок изменить настройки подписки отписаться рассылки ,другое
научная статья курска здравствуйте уважаемый редакция мы направляли вам научную статью исследование работы однофазного синхронного вибрационного микрогенератора источника бесперебойного электроснабжения автономных объектов публикации вашем журнале «вестник вгу серия системный анализ информационные технологиив марте сообщите пожалуйста принята статья публикации ждать издание заранее благодарим вас каунг мьят хту кафедра по аис курский государственный университет ,вопросы
рецензия рецензия на статью воловач docx уважаемая редакция журнала саит высылаю вам оформленную шаблону повторную версию рецензии статью воловача в и артюшенко в м обнаружение сигналов случайным моментом появления переработки ,доработка
сообшение здравствуйте вероника викторовна сентября сего года отсылал вам рассмотрения статью названием проблема определения смысла текста интеллектуальными системами не могли вы сообщить получении с ув одинцов б е ,вопросы
 статья жуков основина здравствуйте отправляли материал рассмотрения возможности публикации хотелось узнать статус работы жуков основина ольга основина пётр жуков,вопросы
волонтеррецензент добрый день уважаемая редакция меня зовут виктор попов являюсь большим фанатом активным читателем журнала «вестник вгу серия системный анализ информационные технологии» этот журнал позволяет постоянно развиваться инженерной области оставаться передовом крае своей профессии мне очень хочется помочь журналу дальше процеветать поэтому радостью согласился бесплатно проводить рецензии рукописей немного себе окончил мгту им баумана красным дипломом робототехнические системы мехатроника магистратуру корнеллского университета компьютерным наукам имею патенты свои изобретения “ the apparatus program system and associated method of contactless captu of flat objects mainly due to the local aerodynamic effect ” us provisional pat ser no аппарат программа система ассоциированный метод бесконтактного захвата преимущественно счет локального аэродинамического эффекта “ the apparatus program system and associated method of generating micro foam mainly due to the local aerodynamic effect ” us provisional pat ser no аппарат программа система ассоциированный метод генерации микропены преимущественно счет локального аэродинамического эффекта также опубликованные книги попов в в “ умная робототехника применительно аэродинамическим захватам” lambert academic publishing isbn попов в в “аэродинамическая генерация пены элементами нейросетевого управления” lambert academic publishing isbn помимо имеется множество научных публикаций выступлений конференциях могу выслать подробный документ перечислением всех являюсь советником российской академии естествознания нахожусь этапе рассмотрения национальной палате инженеров я уверен моих компетенций инженерном деле хватит справляться задачей рецензирования рукописей сэкономленные средства пойдут дальнейшее развитие журнала пожалуйста напишите мне вы думаете этому поводу если вам нужны какиелибо документы подтверждающие изложенное выше – большим удовольствием предоставлю попов виктор,другое
запрос публикации статьи уважаемая редакция просьба сообщить принята статья перспективы применения и оценка качества сервисов централизованной оптической архитектуры послана февраля какие замечания ,вопросы
публикация здравствуйте редакция журнала вестник вгу саит июля высылали рецензирование статью применение методов ограниченной кластеризации для исследования техногенной сейсмичности зуенко а а фридман о в журавлева о г сообщите пожалуйста каком этапе рассмотрения находится наша работа математического моделирования фиц кольский нц ран,вопросы
самойлов статья обработчик нечетких запросов бд mongo v docx обработчик нечетких запросов бд mongo v pdf поправил змечания махортова с д best gards nikolay samoylov,доработка
версии статей скорректированными формулами вгу имитац модел полумарковских процессов с дискрет состояниями метод doc вгу сложные системы управления метод doc вгу распредел параметры метод doc здравствуйте вероника викторовна посылаю вам версии статей формате doc скорректированными формулами элементами выполненными equation у опасения какието элементы сделал помощью редактора избыточностью это непонимания александр горин,доработка
 представление статьи уважаемая редакция просим проинформировать статусе статьи значения некоторых частотных характеристик англоязычных текстов авторством котова ю а саниной о в отправленной ваш журнал котов юрий алексеевич к фм н доцент доцент кафедры защиты информации новосибирский государственный технический университет санина ольга валерьевна ответственный автор магистрант года кафедры вычислительной техники новосибирский государственный технический университет,вопросы
леденевой статья леденеватм саит pdf леденеватм саит docx вероника доброе утро высылаю статью третьего номера ,подача статьи
 назначение рецензента сычев vestnik vsu пишет александр анатольевич статья количественный подход к оценке влияния литературных произведений с использованием теории графов в а ковун и л каширина нужно назначить рецензента если что темой занимается сычев магистрами исследовала социальные графы исп этих метрик питоне ,рецензирование
конференция аппмим уважаемый коллега хотим проинформировать вас срок подачи докладов оргвзносов перенесены сентября октября для участия конференции необходимо сайт конференции подать доклад прикрепить сканкопию оплате оргвзноса заполнить регистрационную форму предварительная заявка конференцию требуется обратите внимание правила оформления докладов способы оплаты оргвзноса представлены сайте все принятые статьи будут опубликованы электронном сборнике научных трудов конференции проиндексированы ринц электронному сборнику научных трудов присвоен международный книжный номер isbn напоминаем поступившие программный комитет тексты докладов будут проходить отбор опубликования иностранном научном журнале индексируемом web of science и или scopus в случае получения рекомендации опубликованию вам отправлено уведомление важно для публикации статьи данных изданиях необходимо очное участие конференции более подробную информацию получить сайте конференции оргкомитета,другое
