text,category
повторная отправка рецензия гаршиной doc добрый вечер отсылаю материалы рецензии работу курсанта если чтото посчитаешь нужным изменить буду за заранее благодарен до свидания ,рецензирование
 шаблон рецензии новый спасибо нечаев ,другое
 статья вестник саит рецензия рецензия толстоброва статью а с платонова docx добрый день посылаю рецензию толстобров александр павлович mailto тел моб тел skype tapvsu уважаемый александр павлович просьба отрецензировать статью оптимизация структуры базы данных информационной системы контроля образовательных достижений учащихся а с платонова прикрепляю также новый вариант шаблона рецензии гаршина в в ,рецензирование
 статья рецензирования рецензия на проблема защита пользователей docx доброе время суток вероника викторовна высылаю рецензию вложении до связи сергей ариевич добрый день прислали статью журнал проблема защиты пользователей в киберпространстве современный подход к с савина а в поначугин прошу отрецензировать p s статья кажется слабой не научной студенческой соотв уровню журнала прикрепляю новый шаблон рецензии ,рецензирование
 рецензия статью рецензия толстоброва статью черненькаямагер docx добрый день посылаю рецензию толстобров александр павлович mailto тел моб тел skype tapvsu уважаемый александр павлович прошу отрецензировать статью система онлайн обеспечения качества образовательных программ л в черненькая в е магер санктпетербургский политехнический университет петра великого гаршина в в ,рецензирование
 сверка статьи,проверка статьи
 сверка статьи спасибо привет я отправила авторам статью сверки на всякий случай прикрепляю тебе,проверка статьи
 сверка статьи спасибо в е исправим готовый pdf номера размещен уважаемые коллеги все понравилось незначительных замечания стр последнем абзаце формулой iint должно курсивом int нижнем регистре очень желательно повысить контрастность рисунков в оригинале выглядят четче спасибо хорошую работу в е уважаемые авторы просьба срочно проверить верстку статьи ошибки если неточности пришлите список найденных ошибок ,готово к публикации
статья шубина васева авторы свед docx рисунки шубина васева rar статья шубина васева docx здравствуйте отправляю статью сведения авторах буду благодарна информацию получении файлов возможности публикации с уважением е с васева ,подача статьи
статьи № года статья нечаев соавторы текст doc статья нечаев соавторы текст doc уважаемая вероника викторовна соответствии нашими договоренностями отправляю вам статьи публикации статей № года экспертные заключения рецензии от радченко юрия степановича физфак подписаны принесу вам кафедру отдельно ,подача статьи
 сверка статьи снимок рис jpg извините задержку ответом болеем аннотацию ключевые слова проверил прошлый раз сомнений возникло высылаю рисунок формате jpeg подписи попробуйте м б лучше в е по верстке проблемы проверьте аннотацию ключевые слова английском есть замечание качеству перевода рисунки самостоятельно качеству представленного wordского документа вытянем пришлите рисунки хорошего качества отдельными файлами форматы png tif jpg также нужно удалить подрисуночную подпись первого рисунка спасибо в е исправим готовый pdf номера размещен уважаемые коллеги все понравилось незначительных замечания стр последнем абзаце формулой iint должно курсивом int нижнем регистре очень желательно повысить контрастность рисунков в оригинале выглядят четче спасибо хорошую работу в е уважаемые авторы просьба срочно проверить верстку статьи ошибки если неточности пришлите список найденных ошибок ,доработка
рисунки получили вы рисунок по поводу второго рисунка это принтскрин ним наверное сложно чтото сделать в е ,вопросы
 доп инф статье спасибо посмотрим однако просим снять статью рецензирования публикации вашем журнале связи неактуальностью best gards artem lobantsev telegram уважаемые авторы в связи версткой статьи онтологическая система хранения текущих результатов медицинской диагностики возникли вопросы в тексте ссылки рис самих рисунков нет проверьте весь текст статьи ,отклонена
 верстка статьи здравствуйте замечаний нет недостающие данные nenadovich dm dr of tech sciences leading searcher corporation special space systems comet moscow удк ненадович д м ,доработка
рецензия предлагаемый шаблонсаит docx когда выложим требования статьям согласовали все иначе нам придется бесконечности рецензировать такие статьи не обязательно ждать выхода нового номера ,другое
статья вестник вгу системный анализ информационные технологии bondavlopatkinsmirnov posadka doc pictu jpg pictu jpg pictu jpg pictu jpg pictu jpg pictu jpg опись doc здравствуйте просим принять статью публикации журнале «вестник вгу серия системный анализ информационные технологии» рекомендованным опубликованию результатам доклада xviii международной конференции «информатика проблемы методология технологии» председателем секции компьютерное моделирование фундаментальных прикладных исследованиях м г семеновым для связи наши контакты лопаткин дмитрий викторович бондарев валерий георгиевич до свидания ,подача статьи
 статья сандлер и л комплект документов журнал вестник вгу серия системный анализ информационные технологии добрый день уважаемая редакция не подскажете стадии статья илья сандлер уважаемый автор материалы статьи получены будут переданы рецензирование серия системный анализ информационные технологии добрый день уважаемая редакция я хочу подать статью журнал вестник вгу серия системный анализ информационные технологии раздел математические методы системного анализа управления в приложении архив котором содержится четыре файла опись статья рисунков илья сандлер илья сандлер,вопросы
 статья вестник вгу полицын с а полицына е в применение корпуса текстов для автоматической классикации в комплексе инструментов автоматизированного анализа текстов zip добрый день высылаем расширенную версию статьи итогам конференции публикации вестнике вгу архив электронной версией статьи вложении екатерина,подача статьи
статьи вестниквгутроценко zip гусев скрипченко школьникова rar заключение секции сапр pdf рецензия гусев pdf рецензия паринов pdf рецензия троценко pdf юров терминал rar здравствуйте направляю вам статьи рекомендованные публикации журнале вестник вгу итогам работы секции сапр цифровые технологии xviii международной конференции «информатика проблемы методология технологии» в приложении письму архивы статьями рецензии заключение секции гусев павел,подача статьи
статья саит анализ влияния постоянных управляющих воздействий bilchenko ggjr ng tex source zip bilchenko ggjr ng sait documents zip bilchenko ggjr ng article f cp pdf bilchenko ggjr ng maket col f cp pdf bilchenko ggjr ng sait опис файлов rtf bilchenko ggjr ng figus tiff zip bilchenko ggjr ng figus png zip bilchenko ggjr ng figus eps convpdf zip д ф м н проф шашкин александр иванович т оригинальное сообщение следует,подача статьи
нет темы здравствуйте пишет вам аспирант математического факультета вгу литвинов дмитрий я собираюсь отправить статью журнал вестник вгу серия системный анализ информационные технологии в связи этим несколько вопросов принимаете вы статьи аспирантов какие документы прочие материалы должен предоставить вместе статьей редакцию можно предоставить электронную версию статьи формате tex как долго происходит процесс рецензирования журнале заранее спасибо ,вопросы
 статья публикации article pdf вероника викторовна добрый день к сожалению успели вам отправить статью конца февраля проинформируйте пожалуйста можем успеть опубликовать апрельском номере будем очень признательны такая возможность готовы оперативно учесть любые возможные замечания на всякий случай прикрепленном файле статья рассмотрение спасибо рубен агаджанян gmt vestnik vsu уважаемый автор до конца февраля проводится рецензирование статей выход апрель присылайте материалы статьи рассмотрим бумажный вариант нужен уважаемая редакция я являюсь аспирантом ереванского государственного университета факультет информатики прикладной математики хотел разместить научную статью журнале вестник воронежского государственного университета проинформируйте пожалуйста ожидается ближайшая публикация которую разместить мою статью учетом времени просмотр рецензию спасибо рубен агаджанян email mob a str r meliqyan yevan ra,вопросы
статья публикацию naimushina statia doc здравствуйте уважаемая редакция научного журнала вестник воронежского государственного университета серия системный анализ информационные технологии просим рассмотреть нашу статью целью её публикации вашем журнале ,подача статьи
статья гутова анализ excel гутова docx опись гутова docx добрый день уважаемая редакция журнала во вложении статья опись прошу проверить предмет соответствия требованиям оформлению допустить рецензированию спасибо карина гутова моб тел ,подача статьи
рп кому olga donina спасибо gmt olga donina донина ольга olga donina,другое
рп гаршина zip привет вероника высылаю твои старые рабочие программы ргф ,другое
 таратухин вот вертелось голове чтото забыли может ктото был vestnik vsu пишет управляющий директор европейского исследовательского центра области информационных систем ercis вестфальского уноверситета имени вильгель,другое
 таратухин еще семенова место работы основное с уваженим а сиротаотправлено смартфона samsung galaxy исходное сообщение от vestnik vsu дата gmt кому тема таратухин совсем забыла декабре получили согласие таратухина в в включении состав редколлегии таратухин виктор владимирович профессор доктор философии кандидат технических наук директор глобальному сотрудничеству академической инициативы nextgen компании sap представитель компании стэнфордском университете stanford university usa управляющий директор европейского исследовательского центра области информационных систем ercis вестфальского уноверситета имени вильгельма г мюнстер германия ринц хирш ,другое
задорожний задорожнийусл кот корни docx рис jpg отправляю мою статью вестник искренне проф в задорожний,подача статьи
публикация статьи здравствуйте уважаемая редакция журнала вестник вгу я хочу опубликовать статью вашем журнале но понял исходя информации сайте принимаете статьи электронном виде отпечатанном ,вопросы
нет темы litvinovd bound docx litvinovd bound pict jpg litvinovd bound pict jpg litvinovd bound pict jpg litvinovd bound pict jpg здравствуйте отправляю вам статью литвинова д а поиск минимального ограничения непрерывной функции управления ,подача статьи
статья гутова анализ excel гутова docx опись гутова docx добрый день прошу учитывать статью передана другое издание причине отсутствия ответа спасибо добрый день уважаемая редакция журнала во вложении статья опись прошу проверить предмет соответствия требованиям оформлению допустить рецензированию спасибо карина гутова моб тел спасибо карина гутова моб тел ,отклонена
просьба уважаемая вероника викторовна добрый день хотелось узнать участь статьи совершенствование процесса управления качеством продукции на предприятии с использованием информационных технологий медведицков с и кузьминов в в савончик д а с и пользователь сергей иванович медведицков написал уважаемая вероника викторовна добрый день с новым годом рождеством христовым вас хотелось узнать участь моей статьи последний раз вы сообщали направлена рецензирование прошло месяца информации никакой поступило пользователь vestnik vsu написал уважаемый автор журнал вестник вгу серия системный анализ информационные технологии выходит раза год все статьи проходят рецензирование результатам которого принимается публикации отправляются доработку с возможностью повторного рецензирования отклоняются сейчас принимаем статьи рецензирование правила авторов условия публикаций сайте журнала материалы публикации должны содержать удк название статьи рус англ текст статьи стр times интервал формулы mattype рисунки продублированы отдельными jpeg файлами статья должна структурирована разделам постановка задачи выводы заключение список литературы оформленный библиографическим правилам аннотация статье рус англ сведения авторах рус англ скан акта экспертного заключения возможности публикации материалов из вашей организации аспирантов магистров публикуем соавторстве руководителями уважаемая редакция добрый день прошу вас направить требования предъявляемые статьям заранее благодарен ,вопросы
 сведения саит вак информация члене редколлегиимахортов с д new docx уважаемая вероника викторовна у днях появилась одна публикация scopus высылаю скорректированную информацию члене редколлегии сд уважаемые коллеги для подтверждения вак соответствия компетенции членов редколлегии журнала «вестник воронежского государственного университета серия системный анализ информационные технологии» группе специальностей которой заявлен журнал вестник вгу саит сейчас журнал перечене вак перечень ведущих рецензируемых научных журналов изданий которых должны опубликованы основные научные результаты диссертаций соискание ученых степеней доктора кандидата наук соответствует группе специальностей информатика вычислительная техника управление в настоящий момент идет уточнение списка отдельных специальностей областей науки которым статьи публикуемые нашем журнале будут учитываться ваком в связи этим просим вас представить информацию своей научной деятельности публикационной активности специальностям областям наук указанных прикрепленном файле вас соответствующему шаблону прикрепляю необходимые паспорта специальностей ,подача статьи
 сведения саит вак информация члене редколлегиимахортов с д docx во вложении сд уважаемые коллеги для подтверждения вак соответствия компетенции членов редколлегии журнала «вестник воронежского государственного университета серия системный анализ информационные технологии» группе специальностей которой заявлен журнал вестник вгу саит сейчас журнал перечене вак перечень ведущих рецензируемых научных журналов изданий которых должны опубликованы основные научные результаты диссертаций соискание ученых степеней доктора кандидата наук соответствует группе специальностей информатика вычислительная техника управление в настоящий момент идет уточнение списка отдельных специальностей областей науки которым статьи публикуемые нашем журнале будут учитываться ваком в связи этим просим вас представить информацию своей научной деятельности публикационной активности специальностям областям наук указанных прикрепленном файле вас соответствующему шаблону прикрепляю необходимые паспорта специальностей ,подача статьи
