id,text
567,вероника викторовна здравствуйте вот некоторые соображения статье не очень понятно почему названии статьи идет методика алгоритм одним требований методикам является обоснованность в статье далеко используемые разных этапах работы алгоритма преобразования обосновываются слишком длинная аннотация необходимо сократить часть текста перенести введение почему применяемый статье алгоритм пространственной фильтрации скользящим усреднением является оптимальным по каким критериям оптимален сравнению другими алгоритмами пространственной частотной фильтрации почему например использовать адаптивную медианную билатеральную фильтрацию на этапе выделения контуров применяется алгоритм собеля контрастирования растра лучше например алгоритма canny это вопросу методике повышение контрастности изображения приведет появлению множества лишних шумовых контуров выделении выбранным алгоритмом этапы алгоритма выглядят разрозненно ними отсутствует четкая связь так выделения контуров идет пункт коррекция рельефа поверхности яркостной картине явно упоминается ранее проделанные шаги влияют получаемый результат от материал воспринимается плохо анализ результатов должен развернутым в текущей версии статьи приводится лишь одно изображение лиц одно предложение комментарием относительно черных областей следует выбрать критерии оценки показателей эффективности работы алгоритма провести серию экспериментов понятной форме представить результаты имеются аналогичные алгоритмы коррекции карты глубины изображения если да имеет смысл провести сравнительный анализ набор формул уточнить согласно правилам журнала везде прямые символы д б курсив основного текста греческих символов вроде бы имеются прочие замечания оформлению статья нуждается серьезной доработке в текущем виде публиковать стоит миша посмотри статью вестника с и короткевич ю в минаева методика коррекции карты глубины изображения учетом яркости точек удаленности точки наблюдения дрюченко михаил 
571,здравствуйте просим рассмотреть возможность публикации наших материалов журнале вестник вгу серия системный анализ информационные технологии специальность системный анализ управление обработка информации технические науки с уважением комаров виталий николаевич
580,здравствуйте вероника викторовна вот статья материалам конференции прошу рассмотреть опубликования нашем журнале еще одна такая планируется примерно полторы недели не поздно весеннего номера сд
569,уважаемая вероника викторовна рецензию получил спасибо посмотрим сделать статьей пользуясь случаем поздравляю вас праздником весны желаю вам счастья крепкого здоровья благополучия радости солнечных дней исполнения задуманного владимир иванович воловач уважаемые авторы получена рецензия статью методы оценки формы кривой плотности распределения вероятностей в задачах обработки результатов измерений в и воловач в м артюшенко на основании мнения рецензента статья требует доработки замечаниям затем опубликована нашем журнале текст рецензии замечаниями прикрепляю уважаемые коллеги направляем статью в и воловача в м артюшенко методы оценки формы кривой плотности распределения вероятностей задачах обработки результатов измерений публикации журнале вестник вгу серия системный анализ информационные технологии поскольку прошлый статью готовила публикации коллега т с аббасова г королева позвольте уточнить потребуется после процедуры рецензирования предоставлять статью какиелибо сопроводительное письмо акт экспертизы возможности открытой публикации выписку протокола заседания кафедры пр бумажном виде либо потребуются прислать редакцию какиелибо сканы названных документов заранее благодарен владимир иванович воловач д т н доцент зав кафедрой информационного электронного сервиса поволжского государственного университета сервиса
574,отправляю рецензи с праздником искренне в задорожний уважаемый владимир григорьевич прикрепляю статью рецензию номер саит е и акулинин д с дворецкий и в маркин с и дворецкий с а скворцов оптимизация и управление циклическими процессами адсорбционного разделения синтезгаза и концентрирования водорода тамбов гаршина в в 
587,здравствуйте вероника викторовна высылаю исправленную статью на всякий случай прилагаю также pdf сд
573,добрый день уважаемая вероника викторовна ознакомившись рецензией находя замечания рецензента вполне обоснованными проф в м артюшенко решили перерабатывать нашу статью методы оценки формы кривой плотности распределения вероятностей задачах обработки результатов измерений постараемся ближайшее время подготовить другую статью вашего журнала с наилучшими пожеланиями владимир иванович воловач уважаемые авторы получена рецензия статью методы оценки формы кривой плотности распределения вероятностей в задачах обработки результатов измерений в и воловач в м артюшенко на основании мнения рецензента статья требует доработки замечаниям затем опубликована нашем журнале текст рецензии замечаниями прикрепляю уважаемые коллеги направляем статью в и воловача в м артюшенко методы оценки формы кривой плотности распределения вероятностей задачах обработки результатов измерений публикации журнале вестник вгу серия системный анализ информационные технологии поскольку прошлый статью готовила публикации коллега т с аббасова г королева позвольте уточнить потребуется после процедуры рецензирования предоставлять статью какиелибо сопроводительное письмо акт экспертизы возможности открытой публикации выписку протокола заседания кафедры пр бумажном виде либо потребуются прислать редакцию какиелибо сканы названных документов заранее благодарен владимир иванович воловач д т н доцент зав кафедрой информационного электронного сервиса поволжского государственного университета сервиса
576,добрый день я магистр лгпу имени п п семёноватяншанского я хотела напевать вас научную статью подскажите сколько это стоить входит ваш журнал выйдет публикация отправлено мобильной почты mail ru
585,здравствуйте мною отправлен нучную статью названием исследование работы однофазного синхронного вибрационного микрогенератора источника бесперебойного электроснабжения автономных объектов опубликованию журнале серия системный анализ информационные технологии раздел математические методы системного аализа управления если вас затруднит сможете давать информацию получил нижеприкрепленные статьи графики заранее благадарю вас каунг мьят хту кафедра по аис курский государственный университет 
577,здравствуйте вас беспокоит аспирант государственного университета дубна я хотел опубликовать статью вестнике вгу системный анализ информационные технологии на сайте указано журнал выходит раза год подскажите пожалуйста какие сроки необходимо предоставить материал иметь возможность попасть ближайший выпуск или выпуск аспирант университета дубна научный сотрудник нии атолл махнев юрий владимирович
578,это нашей резьбе отправлено смартфона samsung galaxy исходное сообщение от vestnik vsu дата gmt кому тема кому дать рецензию александр анатольевич пришла статья исследование работы однофазного синхронного вибрационного микрогенератора источника бесперебойного электроснабжения автономных объектов каунг мьят хту в а кудинов курск кому отправить рецензию p s верстку номера завтра сделаем сделаем 
579,спасибо большое ответ гаршина вероника викторовна когда решение известно дайте знать пожалуйста каунг мьят хту кафедра по аис курский государственный университет уважаемые авторы редакцией журнала вестник вгу саит получена статья исследование работы однофазного синхронного вибрационного микрогенератора источника бесперебойного электроснабжения автономных объектов каунг мьят хту в а кудинов статья передана рецензирование результаты сообщим здравствуйте мною отправлен нучную статью названием исследование работы однофазного синхронного вибрационного микрогенератора источника бесперебойного электроснабжения автономных объектов опубликованию журнале серия системный анализ информационные технологии раздел математические методы системного аализа управления если вас затруднит сможете давать информацию получил нижеприкрепленные статьи графики заранее благадарю вас каунг мьят хту кафедра по аис курский государственный университет 
581,мало моделирует матлабе тогда статьи математика публиковать математических журналах дело том что понимаем этих генератора у никто оценит степень новизны корректности модели отправлено смартфона samsung galaxy исходное сообщение от vestnik vsu дата gmt кому sir тема re кому дать рецензию по нашей они моделируют матлабе это нашей резьбе отправлено смартфона samsung galaxy исходное сообщение от vestnik vsu дата gmt кому тема кому дать рецензию александр анатольевич пришла статья исследование работы однофазного синхронного вибрационного микрогенератора источника бесперебойного электроснабжения автономных объектов каунг мьят хту в а кудинов курск кому отправить рецензию p s верстку номера завтра сделаем сделаем 
596,вероника почитала статью седых диагонали мелкие вопросы тексте посмотри лтм татьяна михайловна посмотрите статью линейные и квадратичные нечеткие иерархические окрестностные модели процесса производства холоднокатаной стали и а седых с уважением вероника гаршина
589,вероника добрый вечер высылаю статью баева аверкин рецензия потом поправила все сейчас занимаюсь статьей шаров медведева правлю авторов доходит хотят пришлю позже вечером татьяна михайловна посмотрите статью линейные и квадратичные нечеткие иерархические окрестностные модели процесса производства холоднокатаной стали и а седых с уважением вероника гаршина
591,вероника высылаю вторую статью завтра колумбийцы татьяна михайловна посмотрите статью линейные и квадратичные нечеткие иерархические окрестностные модели процесса производства холоднокатаной стали и а седых с уважением вероника гаршина
609,здравствуйте вероника викторовна еще одна статья вестник материалам конференции с д махортов
612,дубль № исходное сообщение от vestnik vsu отправлено марта г кому makhortov sergey тема re от махортова сергей дмитриевич добрый день пришлите файл doc не открывает пишет ошибку файле здравствуйте вероника викторовна еще одна статья вестник материалам конференции с д махортов
588,вечер добрый высылаю статью возможного опубликования вестники вгу серия системный анализ информационные технологии с уважением владимир ножкин 
732,д ф м н проф шашкин александр иванович т оригинальное сообщение следует
681,д ф м н проф шашкин александр иванович т оригинальное сообщение следует
590,вероника ознакомься предложениями бильченко может стоит воспользоваться ими д ф м н проф шашкин александр иванович т оригинальное сообщение следует
595,здравствуйте хотел разместить вашем журнале статью файл прикрепил примите с уважением лебедев валерий александрович 
593,здравствуйте статье вопрос был чт нояб г никита ефимов внес статью корректировки соответствии рецензией перевел формулы mathtype исправил список литературы приложил файлы рисунков архиве по рисункам понял требовалось сделать речь том рисунки представлены несколькими изображениями необходимо одним могу это исправить просто конца ясно сколько пространства в случае представления текста две колонки объем статьи представлении колонками составляет стр вт нояб г vestnik vsu уважаемый автор получена рецензия статью разработка и исследование мер близости для прецедентной идентификации фрагментов рукописного текста ефимов н о рецензия содержит небольшие замечания устранения которых опубликована номере вестник вгу саит текст рецензии прикрепляю есть замечания оформлению статьи все формулы обозначения символов тексте должны набраны equation mathtype длинные формулы разбить части не см т к верстка колонки должны правильно оформлены рисунки прислать jpg файлами обратите внимание оформление списка литературы прикрепляю правила оформления статей внимательно изучите технические требования 
623,здравствуйте вероника викторовна с расширенной аннотацией сд текст открылся из замечаний нужно расширить аннотацию строк дубль № 
696,вечер добрый вероника викторовна прошу прощения добрый день вы забыли прикрепить текст статьи вечер добрый высылаю статью возможного опубликования вестники вгу серия системный анализ информационные технологии 
705,вечер добрый вероника викторовна прошу прощения высылаю статью с уважением владимир ножкин 
