id,text
853,здравствуйте вероника викторовна посылаю вам версии статей формате doc дополнениями которые вы согласовали леонидом борисовичем афанасьевским файлы рисунков — прежние александр горин
850,уважаемая редакция авторы статьи в и воловач в м артюшенко учли замечания рецензента переработали статью считаю возможным опубликовать статью обнаружение сигналов случайным моментом появления журнале вестник вгу саит ю с радченко vestnik vsu пишет уважаемый юрий степанович авторы в и воловач в м артюшенко прислали доработанный вариант статьи вашим замечаниям просьба повторно провести рецензирование материала прикрепляю вашу рецензию доработанный вариант статьи уважаемая редакция журнала вестник вгу саит высылаю рецензию статьюавторов в и воловач в м артюшенко обнаружения сигналов случайным моментом появления использованием алгоритма кумулятивных сумм замечания указаны рецензии 
852,вероника викторовна здравствуйте я хотела уточнить дошло мое предыдущее письмо статьей моего аспиранта попало кудато спам с уважением каширина и л 
857,открыть письмо браузере уважаемые коллеги приглашаем принять участие серии вебинаров посвященных работе научными журналами спикеры признанные эксперты отрасли расскажут рецензировании соблюдении этических стандартов критериях оценки журналов мнбд соблюдении международных издательских стандартов работе текстами статей политик английском языке вебинары будут проводиться сентябре октябре участие бесплатное размещение рецензий ринц это нужно это делается сентября вебинар посвящен новым рекомендациям ринц размещении рецензий научным статьям заместитель директора elibrary виктор глухов аналитик elpub алексей викулин обсудят преимущества учета рецензий деятельности ученого варианты размещения рецензий ринц действия редакции связанные передачей рецензий ринц спикеры виктор алексеевич глухов заместитель генерального директора научной электронной библиотеки elibrary ru алексей сергеевич викулин аналитик ооо «ваше цифровое издательство» регистрация вебинар открыта этика научных журналов ракурсе требований международных наукометрических баз данных сентября в последнее время возрастает внимание мнбд scopus wos этическим аспектам политики журналов прозрачности деятельности расширяются требования принимаемым журналам возрастает контроль поведением индексируемых журналов на вебинаре будут рассмотрены международные стандарты которые опираются мнбд отборе журналов дальнейшем отслеживании поведения данным мнбд примеры неэтичного поведения недобросовестных журналов т ч попавших мнбд также рост «хищнической активности» посредством посреднических компаний спикер ольга владимировна кириллова к т н президент ассоциации научных редакторов издателей главный редактор журнала «научный редактор издатель» регистрация вебинар открыта англоязычная информация научном журнале стандарты качества проблемы представления сентября распространенным замечанием экспертов мнбд оценке заявок журналов является недостаточное качество резюме авторских аффилиаций материалов сайта прочей информации представляемой английском языке вебинар посвящен следующим проблемам повышения качества англоязычной составляющей научного журнала международные стандарты представления метаданных научной статьи английском языке авторское резюме ключевые слова аффилиации благодарности англоязычная версия вебсайта журнала критерии оценки качества перевода научных текстов английский языке подходы организации процесса подготовки англоязычной информации научном журнале спикер наталья геннадьевна попова к соц н зав каф ин яз ифип уро ран екатеринбург переводчик автор научных работ учебных пособий академическому английскому языку эксперт российского экспертного совета scopus амбассадор doaj россии редактор англоязычного журнала сhanging societies and personalities scopus член редколлегий ряда международных научных журналов регистрация вебинар открыта критерии оценки научных журналов мнбд методы оценки научных журналов scopus сентября в последние несколько лет особенно актуализировался вопрос включения российских журналов международные индексы научного цитирования отвечает стратегической задаче расширения российского присутствия мнбд частности scopus несмотря то критерии отбора источников индексации scopus широко известны научным издателям редакторам усложняющейся системой мониторинга качества контента некоторые аспекты отбора индексации вызывают вопросы требуют пояснения в ходе вебинара будут освещeны расширенные критерии оценки журналов scopus особенности заполнения формы самооценки системы мониторинга качества индексируемых журналов scopus спикер галина петровна якшонок консультант аналитическим сервисам elsevier s t россии республике беларусь регистрация вебинар открыта критерии оценки научных журналов мнбд новое системе оценки научных журналов инструментов web of science международные издательские стандарты октября на вебинаре будут обсуждаться обновленные критерии отбора журналов web of science возможности работы платформой publons рецензентов редакций журналов также современные инструменты редакций журналов научных организаций которые способствуют интеграции научных журналов международное издательское пространство первая часть вебинара посвящена критериям процедуре отбора научных журналов web of science каковы возможности препятствия создания современного международного научного журнала россии каковы шансы попадание российских журналов ведущие базы данных международных научных изданий какими информационными инструментами могут пользоваться издатели редакторы научных журналов будут рассмотрены вопросы новая система критериев отбора научных журналов ключевой базы данных web of science core collection процедура отбора журналов web of science core collection обзор показателей цитируемости научных журналов отчет цитируемости научных журналов journal citation reports год найти зарубежных рецензентов – международная база данных рецензентов научных публикаций publons база данных ведущих научных журналов русском языке russian science citation index спикер валентин григорьевич богоров руководитель отдела образовательных программ clarivate analytics вторая часть вебинара посвящена интеграции международное издательское пространство помощью общедоступных технологий сервисов на дано представление преимуществах использования существующих сервисов призванных интегрировать журнал международное издательское пространство таких журнальная платформа цифровые идентификаторы репозиторий научной организации опишет основные обязательные характеристики расскажет сервисы снимают имеющиеся сложности спикер максим игоревич митрофанов руководитель партнерских программ нэикон амбассадор doaj амбассадор crossref регистрация вебинар открыта рецензирование научных статей октября первая часть вебинара посвящена рецензированию произведений российской научной периодике практике перспективам на будут разобраны следующие темы status quo процессов экспертизы рукописей отечественных научных журналах что такое научная экспертиза как это понятие интерпретируется редакциях отечественных научных журналов современные практики – позитивные негативные – научной экспертизы каким должно научное рецензирование современном научном журнале к вопросу не стандартах регламентах научном здравом смысле перспективы развития рецензирования рамках общего направления трансформации системы научной коммуникации открытая наука – открытый доступ – открытое рецензирование оптимизация процессов рецензирования технологическая itзадача в конце вебинара обсуждаться простой важный вопрос возможно развитие института рецензирования отечественной научной литературе да каким видится это развитие… спикер павел геннадьевич арефьев руководитель отдела аналитики научной электронной библиотеки elibrary ru во второй части вебинара рассмотрен опыт работы рецензентами редактора ведущего международного химического журнала старший редактор журнала chemistry – a european journal“ издательства wiley анна ляшенко расскажет качествах которые делают кандидата подходящим рецензентом перечислит обязанности рецензента расскажет основных принципах написания конструктивной рецензии этике рецензирования вы также узнаете том редактор принимает решение основании двух противоположных рецензий действующий редактор международного журнала приведет примеры своей восьмилетней практики спикер анна ляшенко старший редактор издательства wiley регистрация вебинар открыта приглашаем принять участие международной научнопрактической конференции итогам реализации проекта «поддержка программ развития научных журналов целью вхождения международные наукометрические базы данных» конференция проводиться октября г москве конгрессцентр гостиничный комплекс “вега” мы приглашаем главных редакторов научных журналов директоров издательств представителей организаций – учредителей научных журналов руководителей издательских подразделений вузов научных организаций подробная информация возможность регистрации доступны странице конференции издательские услуги нэикон нэикон оказывает научным журналам весь комплекс услуг предпечатной подготовке печати распространению научных журналов мы делаем верстку pdf html техническое редактирование корректуру литературное редактирование отрисовку переводы печать рассылку отправку выпусков ринц регистрацию doi и многое другое в портфеле издательства нэикон настоящий момент журналов чтобы получить подробную информацию издательских услугах нэикон свяжитесь максимом митрофановым copyright © нэикон все права защищены данное письмо требует ответа по всем возникающим вопросам обращайтесь контактному лицу указанному выше чтобы изменить настройки подписки воспользуйтесь одной ссылок изменить настройки подписки отписаться рассылки 
867,добрый день подскажите получена статья ранее ваш адрес направляла письмо сентября витенбург екатерина александровна ведущий инженер проектировщик cистем информационной безопасности группы проектирования систем информационной безопасности отдел комплексных систем защиты информации департамент системной интеграции ооо иц региональные системы г волгоград ул социалистическая тел тел доб моб добрый день статья принята другим журналом печати связи этим направляю ваш адрес другую статью оформленную требованиям журнала уточните срок рецензирования в случае принятия статьи публикации опубликована витенбург екатерина александровна моб уважаемые авторы редакцией журнала вестник вгу серия саит получена статья формализованная модель оценки защищенности информационной системы предприятия левцова а а витенбург е а статья оформлена действующим правилам журнала см раздел авторам после соответствующей доработки передана рецензирование добрый день подскажите возможна публикация данной статьи вашем журнале какие сроки рецензирования публикации материалов витенбург екатерина александровна моб email 
855, вариантов ликвидации ооо официальная ликвидация фнс т р не выезжать фнс нотариусу оплатой объявления вестнике госпошлиной официальная ликвидация назначением нашего ликвидатора т р старый директор сразу увольняется должности продажа фирмы нерезиденту рф т р полное отсутствие ваших фамилий выписке егрюл директор отсутствует территории рф продажа фирмы гражданину рф т р полное отсутствие ваших фамилий выписке егрюл продажа фирмы гражданину рф последующая официальная ликвидация фнс т р полное отсутствие ваших фамилий выписке ликвидация имени нового учредителя директора все цены «под ключ» всеми пошлинами платежами все оригиналы уставных документов остаются вас всё время – забираем предоставляем акт приемапередачи документов окончательный расчет результату юридическая группа «биржа фирм» напишите нам любым способом течение минут отправим полное описание каждого варианта тел viber whatsapp telegram 
861,добрый день пересылаю вам информацию вебинарах нэикон которыми полезно ознакомиться редакторам наших журналов первый сентября размещении рецензий ринц хлопкова е с оригинальное сообщение следует
862,здравствуйте мною отправлен нучную статью названием исследование работы однофазного синхронного вибрационного микрогенератора источника бесперебойного электроснабжения автономных объектов опубликованию журнале серия системный анализ информационные технологии раздел математические методы системного аализа управления последняя серия нашей статьи включена поэтому хотел знать шанс выбирать нашу статью если вас затруднит сможете давать информацию чем заранее благадарю вас каунг мьят хту кафедра по аис курский государственный университет 
864, vestnik vsu пишет екатерина степановна добрый день в файле приказ инструкция заполнению контракта мое предложение п выпуск продолжающегося научного издания внести кроме гл ред зам гл ред должности помощника верстка это практически специально выделенные сотрудники обычные преподаватели доценты сочетающие работу пед науч деятельностью именно этими сотрудниками журналов вгу проводиться большая ежедневная работа было справедливо учитывать эффективном контракте доц каф тоизи отв секретарь журнала вестник вгу саит
863,я согласен нужно меня vestnik vsu пишет мы каплиевой н а заполняем эффективный контракт решили внести предложение учесть нашу работу журналом правда письмо написала хлопковой е с белизняков н м поговорил козодеровым о а поддержите оригинальное сообщение следует
