id,text,subject,category
82,добрый вечер отсылаю материалы рецензии на работу курсанта если что то посчитаешь нужным изменить то я буду только за заранее благодарен до свидания ,повторная отправка,
83,спасибо нечаев , шаблон рецензии новый ,
90,добрый день посылаю рецензию с уважением толстобров александр павлович mailto tap vsu ru тел моб тел skype tap vsu original message from vestnik vsu mailto cs it cs vsu ru sent friday february pm to tap rcnit vsu ru subject статья вестник саит уважаемый александр павлович просьба отрецензировать статью оптимизация структуры базы данных информационной системы контроля образовательных достижений учащихся а с платонова прикрепляю также новый вариант шаблона рецензии гаршина в в , статья вестник саит рецензия,
98,доброе время суток вероника викторовна высылаю рецензию во вложении до связи original message from vestnik vsu mailto cs it cs vsu ru sent friday february pm to вялых сергей ариевич subject статья для рецензирования сергей ариевич добрый день прислали статью в журнал проблема защиты пользователей в киберпространстве современный подход к с савина а в поначугин прошу отрецензировать p s статья мне кажется слабой не научной студенческой не соотв уровню журнала прикрепляю новый шаблон рецензии с уважением гаршина в в , статья для рецензирования,
92,добрый день посылаю рецензию с уважением толстобров александр павлович mailto tap vsu ru тел моб тел skype tap vsu original message from vestnik vsu mailto cs it cs vsu ru sent sunday february pm to tap vsu ru subject рецензия на статью уважаемый александр павлович прошу отрецензировать статью система он лайн обеспечения качества образовательных программ л в черненькая в е магер санкт петербургский политехнический университет петра великого гаршина в в , рецензия на статью,
80,, сверка статьи,
79,спасибо vestnik vsu cs it cs vsu ru привет я отправила авторам статью для сверки на всякий случай прикрепляю тебе , сверка статьи,
81,спасибо в е февраля г пользователь vestnik vsu cs it cs vsu ru написал исправим готовый pdf номера будет размещен на http www vestnik vsu ru content analiz archive ru asp отв секретарь журнала вестник вгу саит гаршина в в on thu feb владимир евстафьевич магер mv qmd spbstu ru wrote уважаемые коллеги все понравилось есть незначительных замечания на стр в последнем абзаце перед формулой iint должно быть курсивом и int в нижнем регистре очень желательно повысить контрастность рисунков в оригинале они выглядят четче спасибо за хорошую работу в е февраля г пользователь vestnik vsu cs it cs vsu ru написал уважаемые авторы просьба срочно проверить верстку статьи на ошибки если есть неточности то пришлите список найденных ошибок отв секретарь журнала вестник вгу саит гаршина в в , сверка статьи,
123,здравствуйте отправляю статью и сведения об авторах буду благодарна за информацию о получении файлов и о возможности публикации с уважением е с васева ,статья шубина васева,
99,уважаемая вероника викторовна в соответствии с нашими договоренностями отправляю вам статьи для публикации статей в № года экспертные заключения и рецензии от радченко юрия степановича физфак подписаны принесу их вам на кафедру отдельно с уважением нечаев ю б ,статьи в № года,
91,извините за задержку с ответом болеем аннотацию и ключевые слова проверил еще в прошлый раз сомнений не возникло высылаю рисунок в формате jpeg без подписи попробуйте м б этот лучше в е февраля г пользователь vestnik vsu cs it cs vsu ru написал по верстке у нас есть проблемы проверьте аннотацию и ключевые слова на английском есть замечание по качеству перевода рисунки мы самостоятельно по качеству из представленного word ского документа не вытянем пришлите рисунки хорошего качества отдельными файлами форматы png tif jpg также нужно удалить подрисуночную подпись из первого рисунка отв секретарь журнала гаршина в в on fri feb владимир евстафьевич магер mv qmd spbstu ru wrote спасибо в е февраля г пользователь vestnik vsu cs it cs vsu ru написал исправим готовый pdf номера будет размещен на http www vestnik vsu ru content analiz archive ru asp отв секретарь журнала вестник вгу саит гаршина в в on thu feb владимир евстафьевич магер mv qmd spbstu ru wrote уважаемые коллеги все понравилось есть незначительных замечания на стр в последнем абзаце перед формулой iint должно быть курсивом и int в нижнем регистре очень желательно повысить контрастность рисунков в оригинале они выглядят четче спасибо за хорошую работу в е февраля г пользователь vestnik vsu cs it cs vsu ru написал уважаемые авторы просьба срочно проверить верстку статьи на ошибки если есть неточности то пришлите список найденных ошибок отв секретарь журнала вестник вгу саит гаршина в в , сверка статьи,
85,получили ли вы рисунок по поводу второго рисунка это принтскрин с ним наверное сложно что то сделать в е ,рисунки,
86,спасибо посмотрим однако просим снять эту статью с рецензирования и публикации в вашем журнале в связи с неактуальностью best regards artem lobantsev с уважением артём лобанцев telegram http t me lobantsev on feb at vestnik vsu cs it cs vsu ru wrote уважаемые авторы в связи с версткой статьи онтологическая система для хранения текущих результатов медицинской диагностики возникли вопросы в тексте есть ссылки на рис а самих рисунков нет проверьте весь текст статьи отв секретарь журнала вестник вгу саит гаршина в в , доп инф по статье,
89,здравствуйте замечаний нет недостающие данные nenadovich dm dr of tech sciences leading researcher corporation special space systems comet moscow удк с уважением ненадович д м , верстка статьи,
97, когда же мы выложим требования к статьям согласовали уже все иначе нам придется до бесконечности рецензировать такие вот статьи не обязательно же ждать выхода нового номера с уважением а сирота ,рецензия,
100,здравствуйте просим принять статью для публикации в журнале «вестник вгу серия системный анализ и информационные технологии» рекомендованным к опубликованию по результатам доклада xviii международной конференции «информатика проблемы методология технологии» председателем секции компьютерное моделирование в фундаментальных и прикладных исследованиях м г семеновым для связи наши контакты лопаткин дмитрий викторович бондарев валерий георгиевич до свидания с уважением лопаткин дмитрий ,статья в вестник вгу системный анализ и информационные технологии,
95,добрый день уважаемая редакция не подскажете на какой стадии моя статья с уважением илья сандлер sandleri bk ru пятница февраля от vestnik vsu cs it cs vsu ru уважаемый автор материалы статьи получены и будут переданы на рецензирование отв секретарь журнала гаршина вероника викторовна on thu feb илья сандлер sandleri bk ru wrote пересылаемое сообщение от кого илья сандлер sandleri bk ru кому cs it cs it cs vsu ru дата воскресенье февраля тема статья сандлер и л комплект документов в журнал вестник вгу серия системный анализ и информационные технологии добрый день уважаемая редакция я хочу подать статью в журнал вестник вгу серия системный анализ и информационные технологии в раздел математические методы системного анализа и управления в приложении архив к котором содержится четыре файла опись статья и рисунков с уважением илья сандлер sandleri bk ru с уважением илья сандлер sandleri bk ru , статья сандлер и л комплект документов в журнал вестник вгу серия системный анализ и информационные технологии ,
101,добрый день высылаем расширенную версию статьи по итогам конференции для публикации в вестнике вгу архив с электронной версией статьи во вложении с уважением екатерина , статья в вестник вгу,
257, здравствуйте направляю вам статьи рекомендованные для публикации в журнале вестник вгу по итогам работы секции сапр и цифровые технологии xviii международной конференции «информатика проблемы методология технологии» в приложении к письму архивы со статьями рецензии заключение секции с уважением гусев павел ,статьи,
218, с уважением декан факультета пмм вгу д ф м н проф шашкин александр иванович т dean amm vsu ru оригинальное сообщение следует , статья для саит анализ влияния постоянных управляющих воздействий ,
96,здравствуйте пишет вам аспирант математического факультета вгу литвинов дмитрий я собираюсь отправить свою статью в журнал вестник вгу серия системный анализ и информационные технологии в связи с этим у меня есть несколько вопросов принимаете ли вы статьи аспирантов какие документы и прочие материалы я должен предоставить вместе со статьей в редакцию можно ли предоставить электронную версию статьи в формате tex как долго происходит процесс рецензирования в журнале заранее спасибо ,нет темы,
108,вероника викторовна добрый день к сожалению мы не успели вам отправить статью до конца февраля проинформируйте пожалуйста можем ли еще успеть опубликовать в апрельском номере будем очень признательны если будет такая возможность готовы оперативно учесть любые возможные замечания на всякий случай в прикрепленном файле статья на рассмотрение спасибо с уважением рубен агаджанян gmt vestnik vsu cs it cs vsu ru уважаемый автор до конца февраля проводится рецензирование статей в выход апрель присылайте материалы статьи рассмотрим бумажный вариант не нужен отв секретарь журнала гаршина вероника викторовна on wed feb ruben aghajanyan ruboo gmail com wrote уважаемая редакция я являюсь аспирантом ереванского государственного университета факультет информатики и прикладной математики хотел бы разместить свою научную статью в журнале вестник воронежского государственного университета проинформируйте пожалуйста когда ожидается ближайшая публикация на которую можно было бы разместить мою статью с учетом времени на просмотр и рецензию спасибо с уважением рубен агаджанян e mail ruboo gmail com mob a str r meliqyan yerevan ra , статья для публикации,
112, здравствуйте уважаемая редакция научного журнала вестник воронежского государственного университета серия системный анализ и информационные технологии просим рассмотреть нашу статью с целью её публикации в вашем журнале с уважением л н бакановская ,статья на публикацию,
118,добрый день уважаемая редакция журнала во вложении статья и опись прошу проверить на предмет соответствия требованиям к оформлению и допустить к рецензированию спасибо с уважением карина гутова моб тел ,статья гутова ,
104,с уважением копытин а в пересылаемое сообщение от кого алексей копытин alexkopytin gmail com дата марта г тема re рп кому olga donina olga donina mail ru спасибо с уважением копытин а в gmt olga donina olga donina mail ru с уважением best regards mit freundlichen grüßen донина ольга olga donina , рп,
155,привет вероника высылаю твои старые рабочие программы для ргф с уважением копытин а в ,рп,
102,вот у меня и вертелось в голове что то забыли может еще кто то был с уважением а сирота vestnik vsu пишет управляющий директор европейского исследовательского центра в области информационных систем ercis вестфальского уноверситета имени вильгель , таратухин,
106,еще можно семенова если у него место работы основное не у нас с уваженим а сиротаотправлено со смартфона samsung galaxy исходное сообщение от vestnik vsu cs it cs vsu ru дата gmt кому shashkin amm vsu ru algazinov sc vsu ru sir cs vsu ru тема таратухин совсем забыла что в декабре получили согласие от таратухина в в о включении его в состав редколлегии таратухин виктор владимирович профессор доктор философии кандидат технических наук директор по глобальному сотрудничеству академической инициативы next gen компании sap представитель компании в стэнфордском университете stanford university usa управляющий директор европейского исследовательского центра в области информационных систем ercis вестфальского уноверситета имени вильгельма г мюнстер германия ринц хирш с уважением гаршина в в , таратухин,
114,отправляю мою статью в вестник искренне проф в задорожний ,задорожний,
105,здравствуйте уважаемая редакция журнала вестник вгу я хочу опубликовать свою статью в вашем журнале но я не совсем понял исходя из информации на сайте принимаете ли вы статьи в электронном виде или только в отпечатанном с уважением минханов р ф ,публикация статьи,
203,здравствуйте отправляю вам статью литвинова д а поиск минимального ограничения для непрерывной функции управления ,нет темы,
121, добрый день прошу не учитывать статью так как она передана в другое издание по причине отсутствия ответа спасибо пересылаемое сообщение от кого карина гутова karina mail ru кому cs it cs vsu ru дата пятница марта тема статья гутова добрый день уважаемая редакция журнала во вложении статья и опись прошу проверить на предмет соответствия требованиям к оформлению и допустить к рецензированию спасибо с уважением карина гутова моб тел спасибо с уважением карина гутова моб тел , статья гутова ,
107, уважаемая вероника викторовна добрый день хотелось бы узнать участь статьи совершенствование процесса управления качеством продукции на предприятии с использованием информационных технологий медведицков с и кузьминов в в савончик д а с и пользователь сергей иванович медведицков medsim rambler ru написал уважаемая вероника викторовна добрый день с новым годом и рождеством христовым вас хотелось бы узнать участь моей статьи последний раз когда вы мне сообщали что она направлена на рецензирование но уже прошло месяца а информации никакой не поступило пользователь vestnik vsu cs it cs vsu ru написал уважаемый автор журнал вестник вгу серия системный анализ и информационные технологии выходит раза в год все статьи проходят рецензирование по результатам которого принимается к публикации отправляются на доработку с возможностью повторного рецензирования или отклоняются сейчас мы принимаем статьи на рецензирование для и правила для авторов и условия публикаций на сайте журнала http www vestnik vsu ru content analiz index ru asp материалы для публикации должны содержать удк название статьи рус англ текст статьи стр times интервал формулы mattype рисунки продублированы отдельными jpeg файлами статья должна быть структурирована по разделам постановка задачи выводы или заключение список литературы оформленный по библиографическим правилам аннотация к статье рус англ сведения об авторах рус англ скан акта экспертного заключения о возможности публикации материалов из вашей организации аспирантов магистров публикуем в соавторстве с руководителями отв секретарь журнала гаршина вероника викторовна on thu oct сергей иванович медведицков medsim rambler ru wrote уважаемая редакция добрый день прошу вас направить требования предъявляемые к статьям заранее благодарен ,просьба,
