id,text,subject,category
361, здравствуйте я аспирантка и мне нужно опубликовать вак статью хотелось узнать вопроса сколько стоит опубликовать вак статью как скоро она будет опубликована после того когда я вам отправлю с уважением илчева валерия ,вак статьи,
362,глубокоуважаемый коллега напоминаем вам что с по декабря г состоится международная научно техническая конференция «актуальные проблемы прикладной математики информатики и механики» список докладов поданных на конференцию доступен на странице http www amm vsu ru conf index php page doklads для участия в конференции необходимо в срок до октября г заполнить полную регистрационную форму и прикрепить доклад и скан копию об оплате оргвзноса на сайте конференции http www amm vsu ru conf index php page reg обратите внимание на правила оформления докладов http www amm vsu ru conf index php page pravilaoformlmaterials способы оплаты оргвзноса представлены на сайте http www amm vsu ru conf index php page pravilauplatyorganizvznosov все принятые статьи будут опубликованы в электронном сборнике научных трудов конференции и проиндексированы в ринц электронному сборнику научных трудов будет присвоен международный книжный номер isbn напоминаем что поступившие в программный комитет тексты докладов будут проходить отбор для опубликования в научном журнале journal of physics conference series индексируемом в web of science и scopus в случае получения рекомендации к опубликованию вам будет отправлено уведомление не позднее октября важно для публикации статьи в данных изданиях необходимо очное участие в конференции более подробную информацию можно получить на сайте конференции http www amm vsu ru conf index php или у оргкомитета amcsmconf amm vsu ru с уважением оргкомитет ,конференция «актуальные проблемы прикладной математики информатики и механики» ,
365,коллеги добрый день сентября направлял вам статью опыт разработки и внедрения единой системы управления нси ао окб новатор для рассмотрения возможности публикации её в вестнике воронежского государственного технического университета в серии системный анализ и информационные технологии к сожалению от вас не было никакого ответа ни на это письмо ни на письмо от сентября по телефону указанному на сайте дозвониться я не смог прошу отозвать мою просьбу о публикации данной статьи попробую опубликоваться у вас в следующий раз с уважением логинов александр ,отзыв просьбы о публикации статьи,
370,уважаемые коллеги высылаю рецензию на статью алдабаевой о г лукьянова а м и лукьянова а а с уважением в хлебостроев,рецензия docx,
366,вероника викторовна вы выслали журналы по моему адресу адрес правильно указали сергееву а с ул инициативная д кв г таганрог ростовская обл простым или заказным письмом если заказным то можете дать трек для отслеживания на почтовом сайте c уважением сергеев александр сергеевич , сверка статьи,
368,здравствуйте хотел бы узнать результат по статье авг г в vestnik vsu cs it cs vsu ru написал а уважаемый автор редакцией журнала вестник вгу саит получена статья построение регрессионных моделей процесса обогащения железной руды супруненко в в статья передана на рецензирование отв секретарь журнала гаршина вероника викторовна on tue jul victor suprunenko viktorsuprunenko outlook com wrote добрый день хотел бы опубликовать статью в вашем журнале , публикация статьи ,
399, здравствуйте уважаемая вероника викторовна хотел бы просить вас принять мою статью к рассмотрению в редакции журнала системный анализ и информационные технологии с уважением доцент севастопольского гу кротов кирилл викторович kirill krotov,статья кротов doc экспертное воронеж pdf сведения об авторах doc,
371,уважаемые коллеги не могли бы вы хоть что то ответить если статью не приняли то напишите если требуется доработка то мы готовы исправить просто третий месяц живем в неведении четверг августа от vestnik vsu cs it cs vsu ru уважаемые авторы редакцией журнала вестник вгу саит получена статья система поддержки принятия решения выбора претендента на вакантную должность с элементами искусственного интеллекта авторы а м семенов л ф тагирова в к тагиров статья будет передана на рецензирование результаты сообщим отв секретарь журнала гаршина вероника викторовна on sun aug лилия тагирова lg mail ru wrote добрый день уважаемые коллеги редакторы журнала вестник воронежского государственного университета мы хотели опубликовать статью в вашем журнале серия системный анализ и информационные технологии отправляем вам нашу статью и рисунки в отдельных файлах ждем ответа с дальнейшими инструкциями какие еще документы нужны либо какие то коррективы необходимо внести с уважением тагирова л ф с уважением тагирова л ф , публикация статьи,
372,здравствуйте прошло уже достаточно много времени и хотелось бы продублировать свой прежний вопрос и узнать на каком этапе находится статья нам важно опубликовать работу в этом году спасибо vestnik vsu cs it cs vsu ru уважаемые авторы пока рецензия на вашу статью реализация квантового алгоритма для решения транспортной задачи коммивояжера не готова отв секретарь журнала гаршина в в on tue sep potapov s viktor vitya potapov rambler ru wrote здравствуйте статья прошла процесс рецензирования или еще нет спасибо potapov s viktor postgraduate student of the department of computer science institute of computer technology and information security southern federal university пользователь vestnik vsu cs it cs vsu ru написал уважаемые авторы редакцией журнала вестник вгу саит получена статья реализация квантового алгоритма для решения транспортной задачи коммивояжера статья будет передана на рецензирование результаты сообщим отв секретарь журнала гаршина вероника викторовна on sun aug potapov s viktor vitya potapov rambler ru wrote здравствуйте прошу рассмотреть статью на предмет публикации в журнале если потребуются иные документы или правки обязуюсь оперативно предоставить спасибо potapov s viktor postgraduate student of the department of computer science institute of computer technology and information security southern federal university vestnik vsu cs it cs vsu ru уважаемый автор журнал вестник вгу серия саит входит в перечень вак публикации в журнале для всех авторов бесплатные тематика статьи соответствует направлениям журнала если хотите чтобы статья была принята к рецензированию необходимо оформить ее по правилам журнала правила прикрепляю отв секретарь журнала гаршина вероника викторовна on fri aug potapov s viktor vitya potapov rambler ru wrote здравствуйте входит ли журнал в перечень журналов вак какова стоимость публикации статьи подходит ли работа под тематику журнала спасибо potapov s viktor postgraduate student of the department of computer science institute of computer technology and information security southern federal university , re re публикация статьи,
375,приветствую трегубов алексей аспирант пмм вгу хотел бы опубликовать статью по своей научной работе ,article tregubov amm vsu,
405,здравствуйте уважаемая вероника викторовна хотел бы просить вас принять мою статью к рассмотрению в редакции журнала системный анализ и информационные технологии с уважением доцент севастопольского гу кротов кирилл викторович kirill krotov,сведения об авторах doc статья кротов doc экспертное воронеж pdf,
391,добрый день посылаю рецензию добавлю еще что у меня возникает вопрос что в составе чисто программистской работы делают доктора и кандидаты медицинских наук с уважением толстобров александр павлович mailto tap vsu ru тел моб тел skype tap vsu original message from vestnik vsu mailto cs it cs vsu ru sent monday october pm to tap vsu ru subject статья на рецензирование уважаемый александр павлович прошу отрецензировать статью для вестника автоматизированная информационная система учета и мониторинга учебного процесса в вузе в условиях балльно рейтинговой системы а и жданов н а каплиева и в юргелас е в корж р н фролов ю н юргелас д а антонов шаблон рецензии прикрепляю гаршина в в , статья на рецензирование,
376, vestnik vsu пишет татья написана плохим языком и не соответствует общим требованиям к работам публикуемым в научных журналах невозможно понять ни поставленные задачи ни полученные результаты требуется серьезная доработка alexander krylovetsky computer science faculty voronezh state university www cs vsu ru www vsu ru , статья на рецензирование,
535,ув господа сообщите пожалуйста каковы результаты рецензирования моей статьи под названием порождение нового знания для создания баз знаний интеллектуальных систем с ув одинцов б е original message from vestnik vsu mailto cs it cs vsu ru sent monday october pm to борис одинцов subject re статья уважаемый автор ваша статья находится у рецензента результаты рецензирования сообщим отв секретарь журнала гаршина вероника викторовна on mon oct борис одинцов odintsov list ru wrote from борис одинцов mailto odintsov list ru sent wednesday september am to cs it cs vsu ru subject статья здравствуйте ув господа обращаюсь к вам вторично я выслал в ваш адрес свою статью порождение нового знания для создания баз знаний интеллектуальных систем для рецензирования сообщите пожалуйста подходит ли моя работа для вашего издания с ув одинцов б е , статья,
378,нет лучше разнести с уважением а сирота отправлено со смартфона samsung galaxy исходное сообщение от vestnik vsu cs it cs vsu ru дата gmt кому sir cs vsu ru тема задорожний владимир григорьевич предлагает разместить в нам нужно еще в этом же номере о тюкачеве н а статью вставить хорошо ли будет оригинальное сообщение следует , задорожний,
379,здравствуйте вероника викторовна извините что никак не закончу помню об этом и в выходные доделаю вторник октября от vestnik vsu cs it cs vsu ru виктор григорьевич добрый день напоминаю про статью о николае аркадьевиче решили в по времени недели есть вероника гаршина on thu oct виктор хлебостроев vgh mail ru wrote уважаемые коллеги высылаю рецензию на статью алдабаевой о г лукьянова а м и лукьянова а а с уважением в хлебостроев с уважением в хлебостроев , рецензия docx,
393,внес необходимые корректировки файл прилагаю пн окт г в vestnik vsu cs it cs vsu ru уважаемый автор статья ефимов н о разработка и исследование мер близости для прецедентной идентификации фрагментов рукописного текста для рассмотрения к публикации должна быть оформлена в соответствии с правилами журнала правила размещены на сайте журнала http www vestnik vsu ru content analiz index ru asp в разделе авторам отв секретарь журнала гаршина в в on mon oct никита ефимов n o efimov gmail com wrote октября почти два месяца назад я передал вам материалы для рецензирования и дальнейшей публикации с тех пор от вас не было никаких вестей если до конца недели я не получи никакой информации придется принимать меры вс сент г в никита ефимов n o efimov gmail com здравствуйте августа передал вам материалы с расчетом на публикацию в сентябре хотелось бы узнать текущее состояние дел сб авг г в vestnik vsu cs it cs vsu ru материалы статьи получены будут переданы на рецензирование отв секретарь журнала гаршина в в on fri aug никита ефимов n o efimov gmail com wrote здравствуйте высылаю рабочую версию статьи при возможности публикации в сентябре обязуюсь доработать в кратчайшие сроки августа г пользователь vestnik vsu cs it cs vsu ru написал присылайте рассмотрим on sat aug никита n o efimov gmail com wrote здравствуйте предыдущую статью уже отдал в другой журнал но если есть возможность публикации в выпуске за сентябрь могу в течение следующей модели подготовить новую статью материалы есть возможно так сделать с уважением никита авг г в vestnik vsu cs it cs vsu ru написал а уважаемый автор перечисленные вами темы входят в круг научных направлений поддерживаемых нашим журналом присылайте материалы мы рассмотрим сейчас рецензируются статьи в выход сентябрь и выход январь отв секретарь журнала гаршина вероника викторовна on thu jul никита ефимов n o efimov gmail com wrote здравствуйте я аспирант ниу белгу по специальности теоретические основы информатики работаю над системой прецедентной идентификации фрагментов изображений рукописного текста хотел бы опубликовать статьи в журнале вестник вгу серия системный анализ и информационные технологии на темы использование значений энергии в заданных частотных интервалов в качестве признакового пространства в задачах прецедентной идентификации рукописного текста сегментации цифровых изображений рукописного текста разработка и исследование различных мер близости в задачах прецедентной идентификации фрагментов рукописного текста разработка решающей функции интересуют соответствие тематике журнала возможность и сроки публикации , возможность публикации в журнале вестник вгу серия системный анализ и информационные технологии ,
382,здравствуйте уважаемая редакция журнала подскажите пожалуйста еще есть возможность опубликоваться в этом году в вашем журнале «вестник вгу серия системный анализ и информационные технологии» если да то каковы сроки подачи статьи заранее спасибо танюшка григорьева,сроки подачи статей,
383,большое спасибо за информацию среда октября от vestnik vsu cs it cs vsu ru уважаемый автор до мы рассматриваем статьи в номер материал должен быть оформлен в соответствии с правилами нашего журнала http www vestnik vsu ru content analiz index ru asp раздел авторам проводится рецензирование статей по результатам которого принимается решение о включении статьи в номер отв секретарь вестник вгу саит гаршина вероника викторовна on wed oct танюшка григорьева tanya grig mail ru wrote здравствуйте уважаемая редакция журнала подскажите пожалуйста еще есть возможность опубликоваться в этом году в вашем журнале «вестник вгу серия системный анализ и информационные технологии» если да то каковы сроки подачи статьи заранее спасибо танюшка григорьева танюшка григорьева , сроки подачи статей,
389,глубокоуважаемая редакция высылаю статью для возможной публикации в вашем журнале в смысле оформления согласно правилам журнала сделали все что смогли с наилучшими пожеланиями авторы галина курина,статья м а калашниковой г а куриной,
384, сегодня файл сегодня файл сегодня файл глубокоуважаемая редакция очень просим вас прислать корректуру статьи с наилучшими пожеланиями авторы глубокоуважаемая редакция высылаю статью для возможной публикации в вашем журнале в смысле оформления согласно правилам журнала сделали все что смогли с наилучшими пожеланиями авторы глубокоуважаемая редакция высылаю статью для возможной публикации в вашем журнале в смысле оформления согласно правилам журнала сделали все что смогли с наилучшими пожеланиями авторы глубокоуважаемая редакция высылаю статью для возможной публикации в вашем журнале в смысле оформления согласно правилам журнала сделали все что смогли с наилучшими пожеланиями авторы галина курина,статья м а калашниковой г а куриной,
