id,text,subject,category
865,вероника викторовна здравствуйте мне обложка не нужна она у меня есть я сделала свой шаблон мне нужна страница с выходными данными можно сфотографировать и прислать в whatsapp или viber чт сент г в vestnik vsu cs it cs vsu ru наталья алексеевна добрый день прислали обложку для саит надо сделать pdf a пересылаю я тут предлагаю дать нам возможность учесть нашу работу в журнале в эффективном контракте попросила хлопкову и белизнякова поговорить с козодеровым видимо кто составлял инструкцию по заполнению контракта не очень понимает кто и что делает в процессе издания науч журнала с уважением гаршина в в оригинальное сообщение следует forwarded message from хлопкова екатерина степановна khlopkova vsu ru to vestnik vsu cs it cs vsu ru cc bcc date thu sep subject re эффективный контракт вгу vestnik vsu пишет екатерина степановна добрый день в файле приказ есть инструкция по заполнению контракта мое предложение в п выпуск продолжающегося научного издания внести кроме гл ред и зам гл ред еще и должности ответственного секретаря издания и технического помощника верстка это практически всегда не специально выделенные сотрудники а обычные преподаватели и доценты сочетающие эту работу с пед и науч деятельностью именно этими сотрудниками всех журналов вгу проводиться большая ежедневная работа было бы справедливо ее учитывать в эффективном контракте с уважением гаршина в в доц каф тоизи отв секретарь журнала вестник вгу саит , эффективный контракт вгу,
866,не могу скан не работает сделайте сами с журнала с уважением е с vestnik vsu пишет екатерина степановна пришлите скан страницы с выходными данными саит с уважением гаршина в в , для pdf a,
1049,добрый день хотела бы уточнить результаты рецензирования статьи с уважением витенбург екатерина александровна главный инженер проектировщик cистем информационной безопасности группы проектирования систем информационной безопасности отдел аналитики и проеткирования систем информационной безопасности департамент системной интеграции ооо иц региональные системы г волгоград ул социалистическая тел тел доб моб original message from vestnik vsu cs it cs vsu ru sent friday september pm to витенбург екатерина александровна e vitenburg ec rs ru subject re публикация статьи уважаемые авторы редакцией журнала вестник вгу саит получены материалы статьи математическая модель интеллектуальной поддержки принятия решений при проектировании системы защиты информационной системы предприятия с учетом мониторинга событий безопасности статья передана на рецензирование недели рецензируем статьи в номер выход январь отв секретарь журнала гаршина в в on wed sep витенбург екатерина александровна e vitenburg ec rs ru wrote добрый день статья принята другим журналом к печати в связи с этим направляю в ваш адрес другую статью оформленную по требованиям журнала уточните срок рецензирования в случае принятия статьи к публикации когда будет опубликована витенбург екатерина александровна моб original message from vestnik vsu cs it cs vsu ru sent monday september am to витенбург екатерина александровна e vitenburg ec rs ru subject re публикация статьи уважаемые авторы редакцией журнала вестник вгу серия саит получена статья формализованная модель оценки защищенности информационной системы предприятия левцова а а витенбург е а статья не оформлена по действующим правилам журнала http www vestnik vsu ru content analiz index ru asp см раздел авторам после соответствующей доработки может быть передана на рецензирование отв секретарь журнала гаршина вероника викторовна on wed jul витенбург екатерина александровна e vitenburg ec rs ru wrote добрый день подскажите возможна ли публикация данной статьи в вашем журнале какие сроки рецензирования и публикации материалов с уважением витенбург екатерина александровна моб e mail e vitenburg ec rs ru mailto e vitenburg ec rs ru , публикация статьи,
869,отлично спасибо большое витенбург екатерина александровна моб original message from vestnik vsu cs it cs vsu ru sent friday september pm to витенбург екатерина александровна e vitenburg ec rs ru subject re публикация статьи уважаемые авторы редакцией журнала вестник вгу саит получены материалы статьи математическая модель интеллектуальной поддержки принятия решений при проектировании системы защиты информационной системы предприятия с учетом мониторинга событий безопасности статья передана на рецензирование недели рецензируем статьи в номер выход январь отв секретарь журнала гаршина в в on wed sep витенбург екатерина александровна e vitenburg ec rs ru wrote добрый день статья принята другим журналом к печати в связи с этим направляю в ваш адрес другую статью оформленную по требованиям журнала уточните срок рецензирования в случае принятия статьи к публикации когда будет опубликована витенбург екатерина александровна моб original message from vestnik vsu cs it cs vsu ru sent monday september am to витенбург екатерина александровна e vitenburg ec rs ru subject re публикация статьи уважаемые авторы редакцией журнала вестник вгу серия саит получена статья формализованная модель оценки защищенности информационной системы предприятия левцова а а витенбург е а статья не оформлена по действующим правилам журнала http www vestnik vsu ru content analiz index ru asp см раздел авторам после соответствующей доработки может быть передана на рецензирование отв секретарь журнала гаршина вероника викторовна on wed jul витенбург екатерина александровна e vitenburg ec rs ru wrote добрый день подскажите возможна ли публикация данной статьи в вашем журнале какие сроки рецензирования и публикации материалов с уважением витенбург екатерина александровна моб e mail e vitenburg ec rs ru mailto e vitenburg ec rs ru , публикация статьи,
902,добрый день прошу уточнить результаты рецензирования статьи информация в письме ниже с уважением витенбург екатерина александровна original message from vestnik vsu cs it cs vsu ru sent friday september pm to витенбург екатерина александровна e vitenburg ec rs ru subject re публикация статьи уважаемые авторы редакцией журнала вестник вгу саит получены материалы статьи математическая модель интеллектуальной поддержки принятия решений при проектировании системы защиты информационной системы предприятия с учетом мониторинга событий безопасности статья передана на рецензирование недели рецензируем статьи в номер выход январь отв секретарь журнала гаршина в в on wed sep витенбург екатерина александровна e vitenburg ec rs ru wrote добрый день статья принята другим журналом к печати в связи с этим направляю в ваш адрес другую статью оформленную по требованиям журнала уточните срок рецензирования в случае принятия статьи к публикации когда будет опубликована витенбург екатерина александровна моб original message from vestnik vsu cs it cs vsu ru sent monday september am to витенбург екатерина александровна e vitenburg ec rs ru subject re публикация статьи уважаемые авторы редакцией журнала вестник вгу серия саит получена статья формализованная модель оценки защищенности информационной системы предприятия левцова а а витенбург е а статья не оформлена по действующим правилам журнала http www vestnik vsu ru content analiz index ru asp см раздел авторам после соответствующей доработки может быть передана на рецензирование отв секретарь журнала гаршина вероника викторовна on wed jul витенбург екатерина александровна e vitenburg ec rs ru wrote добрый день подскажите возможна ли публикация данной статьи в вашем журнале какие сроки рецензирования и публикации материалов с уважением витенбург екатерина александровна моб e mail e vitenburg ec rs ru mailto e vitenburg ec rs ru , публикация статьи,
873,вероника добрый день высылаю вам статью моего ученика докторант для вестника татьяна михайловна леденева сказала что даст нам рецензию с уважением азарнова т в ,статья от азарновой,
903,здравствуйте вероника викторовна статья – во вложении… с уважением сд ,от махортова,
875, открыть письмо в браузере https mailchi mp neicon ru qninkbhd e cc https neicon ru уважаемые коллеги приглашаем вас в проект «открытая наука россии» https xnafcdbalictafooklqio xnpai public application item id df da c cc поддержанный фондом президентских грантов в году «открытая наука россии» является продолжением и развитием проекта«национальный агрегатор открытых репозиториев» нора https openrepository ru сегодня нора объединяет уже российских организаций оба проекта выполняет консорциум нэикон в партнерстве с ведущими российскими университетами и научно исследовательскими организациями в – гг будут решены следующие практические задачи модернизация репозиториев и платформы нора в соответствии с новыми международными требованиями наполнение российских репозиториев и интеграция их ресурсов в мировые открытые системы развитие новых сервисов технического сопровождения и наполнения репозиториев развитие новых сервисов для авторов популяризация проекта повышение информационной и правовой грамотности целевых групп проекта преимущества вашего участия в проекте подтвержденные опытом партнеров нора рост числа и расширения географии обращений к ресурсам вашего репозитория за счет повышения их видимости в мировом информационном пространстве рост показателей использования и цитирования публикаций ученых вашей организации за счет их размещения в мировом пространстве публикаций зеленого открытого доступа экспорт метаданных ресурсов вашего репозитория в международные каталоги и базы данных worldcat openaire base все настройки по экспорту выполнит нэикон резервирование и хранение ресурсов вашего репозитория на платформе нора повышение информационной и правовой грамотности сотрудников вашей организации за счет участия в мероприятиях проекта организация мероприятий проекта на вашей площадке для непрерывного образования участников целевых групп проекта в вашем регионе участие в проекте бесплатное в – гг нэикон разработает для вас рекомендации по созданию метаданных в соответствии с современными международными стандартами и требованиями plan s технологии экспорта записей из web of science и scopus в репозитории организаций – участников нора мероприятия проекта «открытая наука россии» пройдут во владивостоке калининграде москве новосибирске санкт петербурге и судаке условия подключения к платформе нора описаны на странице «как подключиться» https openrepository ru connect материалы прошедших семинаров опубликованы в разделе «мероприятия» https openrepository ru about videozapisi seminarov опубликованные методические материалы можно найти по ссылке https openrepository ru about metodicheskie materialy если у вас есть вопросы об участии в проекте их можно задать в ответ на это письмо услуги для библиотек и научных организаций в ответ на потребность научных организаций в предоставлении доступа к результатам научных исследований нэикон разработал сервис “репозиторий научной организации” репозиторий агрегирует данные о научных исследованиях организации и является единой точкой доступа к ним позволяет управлять авторскими правами передавать метаданные в российские и международные поисковые системы повышает видимость и цитируемость работ в том числе архивных чтобы узнать больше о сервисе “репозиторий научной организации” свяжитесь с максимом митрофановым mmi elpub ru copyright © нэикон все права защищены данное письмо не требует ответа по всем возникающим вопросам обращайтесь к контактному лицу указанному выше чтобы изменить настройки подписки воспользуйтесь одной из ссылок изменить настройки подписки https neicon us list manage com profile u cfbada id aaefafa e cc или отписаться от рассылки https neicon us list manage com unsubscribe u cfbada id aaefafa e cc c be ,приглашаем в проект «открытая наука россии» ,
874,здравствуйте уважаемый редакция мы направляли вам научную статью исследование работы однофазного синхронного вибрационного микрогенератора источника бесперебойного электроснабжения автономных объектов для публикации в вашем журнале «вестник вгу серия системный анализ и информационные технологиив марте сообщите пожалуйста принята ли статья к публикации и когда можно ждать ее издание заранее благодарим вас с уважением каунг мьят хту кафедра по и аис курский государственный университет ,научная статья из курска ,
876,уважаемая редакция журнала саит высылаю вам оформленную по шаблону повторную версию рецензии на статью воловача в и артюшенко в м обнаружение сигналов со случайным моментом появления после ее переработки с уважением ю с радченко ,рецензия,
878,здравствуйте вероника викторовна сентября сего года я отсылал вам для рассмотрения свою статью под названием проблема определения смысла текста интеллектуальными системами не могли бы вы сообщить мне о ее получении с ув одинцов б е ,сообшение ,
877,здравствуйте отправляли вам материал для рассмотрения возможности публикации хотелось бы узнать статус работы с уважением авторы жуков основина vestnik vsu cs it cs vsu ru уважаемые авторы материалы статьи поручены редакцией и переданы на рецензирование отв секретарь журнала гаршина в в on thu may пётр жуков zhukov petr yandex ru wrote здравствуйте уважаемая редакция отправляем вам в приложенном файле материал для рассмотрения возможности опубликования очень надеемся на плодотворное и позитивное сотрудничество контактные телефоны ольга основина пётр жуков , статья жуков основина,
